meeting,date,day,modality,unit,title,driving_question,secondary_questions,approach,claim_permitted,claim_not_permitted,rdss_reading,cb_reading,other_material,provenance,concepts,python_r_dependency,dataset_simulation,minute_dynamic,hands_on_activity,practice,discussion_prompt,project_connection,milestone_developed,milestone_work_time,milestone_presentation_review,student_prep,student_artifact,exit_ticket,homework_next_milestone,instructor_prep,risks_contingency
19,2026-10-07,Wed,in-person,Phase 3 — Data & answer strategies,Answer strategy II: regression as an estimator (not an oracle),What is regression actually doing for you — and what is it quietly assuming?,"How is regression 'difference-in-means with adjustment'? What do coefficients mean under a descriptive vs causal reading? What are robust standard errors, intuitively?",inference + causal (answer strategy),"""Adjusting for the variables I named, the association between X and Y is [estimate ± uncertainty].""",Reading a regression coefficient as a causal effect because covariates were 'controlled for.',RDSS ch. 9 regression/estimator sections (book.declaredesign.org),,nb09 §3–4 (Colab); statsmodels docs (linked),RDSS ch.9 (lm_robust workflow) | answer strategies | estimatr::lm_robust → statsmodels OLS + HC2 | translated (R→Python),regression as adjusted comparison; coefficient readings by approach; robust (HC2) standard errors; 'controlling for' ≠ identifying,"statsmodels (OLS with HC2 robust SEs), pandas","lapop_brazil.csv (one adjusted association, descriptive reading)","0–5 M05 final-call + triad flash quiz; 5–13 mini-lesson: regression rebuilt from difference-in-means, one adjustment at a time on the board; 13–27 hands-on: nb09 fit the same model twice (classical vs robust SEs), read the coefficient aloud in DESCRIPTIVE language, then write the forbidden causal sentence and cross it out; 27–37 lab: sketch the regression YOUR project would run (outcome, key regressor, 2 honest covariates) in the M06 template; 37–46 peer check: partner reads your coefficient sentence — is it inside the claim boundary?; 46–50 exit ticket.","Fit an adjusted association in lapop_brazil, read it strictly descriptively, and physically cross out the causal overread.","📝 nb09 practice: 4 coefficient sentences — mark each as permitted (descriptive), permitted (causal, IF identified), or forbidden.","'We controlled for everything we could think of.' Why is that sentence a confession, not a defense?","Each project's M06 answer-strategy declaration takes concrete shape (model, estimator, uncertainty plan).",M06 — Answer Strategy Declaration,10 min (own regression sketch in the M06 template),peer boundary-check of the coefficient sentence,M05 final due tonight 11:59 PM; RDSS ch. 9 regression sections read.,Twice-fit model output + crossed-out forbidden sentence + own M06 sketch,"Claim Ticket #19: my coefficient sentence, worded inside the boundary of my approach.",Draft the URC abstract (150–250 words) using the abstract template — internal gate FRIDAY Oct 9. M06 continues Monday.,Pre-fit the lapop model; prepare the board build-up from difference-in-means; abstract template posted.,statsmodels output overwhelms → nb09 wraps the fit in a helper that prints only the three numbers that matter today.
20,2026-10-09,Fri,in-person,Phase 3 — Data & answer strategies,Inference deep dive I: uncertainty — and the URC abstract gate,"How wrong could you be, and can you say so with a straight face?",Where does sampling variability come from? What does a confidence interval actually promise? Why must the abstract already carry uncertainty language?,INFERENCE (deep dive),"""My estimate is X; under my design, estimates this far from truth happen rarely — here is the interval.""","A bare point estimate narrated as the truth (""the effect IS 4.2"") — uncertainty deleted is certainty invented.",RDSS ch. 9–10 uncertainty sections (book.declaredesign.org),,nb10 §1–2 (Colab); URC abstract template,RDSS ch.9–10 | uncertainty via simulation | sampling-distribution sim built on the source concept | newly-constructed-from-source-concept,sampling distribution (by simulation); standard error; confidence interval as a procedure property; uncertainty-first writing,"numpy (replicate the design 1,000×), matplotlib (sampling distribution)","seeded 1,000-replication simulation of each student's simplified design","0–5 abstract-gate roll call (drafts open on screens); 5–13 mini-lesson: run the SAME design 1,000 times — the histogram of answers IS your uncertainty; 13–20 pause-and-predict: will a sample of 400 halve the spread of a sample of 100? commit; 20–33 hands-on: nb10 replicate the design at n=100 vs n=400, compare spreads, extract the interval; 33–45 ABSTRACT WORKSHOP: apply the uncertainty-language checklist to your URC abstract, partner swap, final edits; 45–50 submit the abstract (internal gate) + exit ticket.","Replicate your simplified design 1,000 times at two sample sizes; watch uncertainty shrink by √n, not by wishing.",📝 nb10 practice: rewrite 3 overcertain sentences into interval-bearing sentences without burying the finding.,A reader skims only your abstract. What single uncertainty phrase most protects them from over-believing you?,URC abstract (M07 part 1) clears its internal gate today — the project is now publicly committed.,M07 — URC Abstract (internal gate TODAY) + Full Design Declaration,12 min (abstract workshop) + submission,partner abstract swap with uncertainty-language checklist,URC abstract drafted (Wednesday's homework); nb09 complete.,Submitted URC abstract + two-sample-size uncertainty comparison,"Claim Ticket #20: my headline finding-to-be, stated WITH its uncertainty, in ≤25 words.",Fall break Monday — no class. For Wed Oct 14: RDSS ch. 10 'Diagnosing designs' opening; M06 declaration due Wed night.,Abstract checklist copies; confirm the URC submission mechanics/deadline status (external date still TBD — internal gate binds today).,External URC portal/deadline shifts → internal gate stands regardless; abstracts are submitted to Brightspace and forwarded when the portal opens.
21,2026-10-14,Wed,in-person,Phase 3 — Data & answer strategies,Inference deep dive II: generalization and the association-is-not-causation boundary,Your sample shows a pattern. To whom does it apply — and what may you NOT say about why?,"What breaks generalization (selection, attrition, non-response)? Why does adjusting not equal identifying? What does an honest inferential claim look like end-to-end?",INFERENCE (deep dive),"""In the population my frame reaches, X and Y are associated by [estimate ± interval], robust to [checks].""",The silent upgrade: association → 'link' → 'impact' → 'effect' across paragraphs — each word a claim your design didn't buy.,RDSS ch. 15–16 (observational descriptive → causal boundary; book.declaredesign.org),optional: callingbullshit.org 'correlation ≠ causation' case,nb10 §3–4 (Colab),RDSS ch.15–16 + rdss lapop_brazil | observational designs | selection stress-test built fresh on the concept | extended,generalization threats; non-response; the language ladder of overclaiming; end-to-end inferential claim anatomy,pandas/numpy (simulate non-response biasing the lapop estimate),lapop_brazil.csv + seeded non-response filter,"0–5 fall-break re-entry + M06 status pulse; 5–12 mini-lesson: the language ladder of overclaiming, climbed on the board with a real headline; 12–19 pause-and-predict: delete the least-trusting 20% of respondents — which way does mean trust move? commit; 19–32 hands-on: nb10 apply the non-response filter, measure the bias, write the now-honest generalization sentence; 32–44 M06 clinic: apply the full claim-anatomy checklist to your own declaration, rotating instructor consults; 44–48 pair proof-read of each other's permitted/not-permitted lines; 48–50 exit ticket.",Simulate non-response in lapop_brazil and measure exactly how far it moves the estimate you would have reported.,📝 nb10 practice: climb-down drill — take 3 overclaimed sentences down the ladder to what the design bought.,Find the exact sentence in a real abstract where association quietly became causation. What word did the smuggling?,M06 declarations get their final clinic before tonight's deadline.,M06 — Answer Strategy Declaration (submitted tonight),12 min (M06 clinic with consults),rotating instructor consults + pair proof-read,M06 near-final; RDSS ch. 15–16 boundary sections skimmed.,Bias measurement + honest generalization sentence + final M06,"Claim Ticket #21: the word I am most tempted to smuggle into my claims, and its honest replacement.",Submit M06 tonight 11:59 PM. Friday: assemble the FULL design declaration (M07 part 2) — bring all MIDA pieces.,Real-headline ladder example; consult order; check M06 drafts midweek.,Post-break fog → open with the 3-minute whole-course-so-far recap slide before the mini-lesson.
22,2026-10-16,Fri,in-person,Phase 3 — Data & answer strategies,Inference deep dive III: power — and assembling the full design declaration,Could your design even detect the thing you are looking for?,"What is statistical power, by simulation? What kills power (n, noise, effect size)? What does a complete MIDA declaration look like on one page?",INFERENCE (deep dive),"""At my n and plausible effect sizes, my design finds a real effect [P]% of the time — I checked before collecting data.""","""We found nothing, so there is nothing"" from a design that could barely have found anything (absence of evidence, underpowered edition).",RDSS ch. 10 'Diagnosing designs' §power (book.declaredesign.org); problem set 1 (concepts),,nb10 §5 (Colab); M07 one-page declaration template,rdss-problem-set-1.Rmd + RDSS ch.10 | power analysis with design diagnosis | PS1 power simulation translated | translated (R→Python),"power by simulation; the power triangle (n, noise, effect); minimum detectable effect intuition; the one-page MIDA declaration","numpy (power simulation loop), matplotlib (power curve)",seeded power simulation over a grid of n and effect sizes,"0–5 pop quiz: the four MIDA letters, each in five words; 5–12 mini-lesson: power as a batting average you compute BEFORE the season; 12–19 pause-and-predict: at n=50 and a small effect, how often does our design 'find it'? commit a percentage; 19–32 hands-on: nb10 run the power grid, find YOUR design's approximate power, locate the n that would double it; 32–45 DECLARATION ASSEMBLY: compile Model+Inquiry+Data+Answer into the one-page M07 declaration, rotating consults; 45–50 declarations submitted + exit ticket.",Run a power grid and locate your own design on it; find what change would most raise your power.,"📝 nb10 practice: rank 4 design tweaks by how much each raises power, then verify by simulation.","Your power is 30%. Is running the study anyway unethical, merely risky, or defensible with the right framing?",M07 (full design declaration) submits today — the complete MIDA blueprint every later milestone builds on.,M07 — Full Design Declaration (submitted TODAY),13 min (assembly + consults),rotating instructor consults during assembly,All MIDA pieces (M03–M06) at hand; RDSS ch. 10 §power skimmed.,Power-grid location for own design + submitted one-page M07 declaration,Claim Ticket #22: my design's approximate power and the single change that would raise it most.,Weekend: rest — the declaration is in. Monday begins the diagnosis engine (RDSS ch. 10 in full).,Verify power-grid cells run <30s; print declaration templates; consult order.,"Power simulation too slow live → pre-computed grid ships in the notebook, students interpolate their design instead of re-running."
23,2026-10-19,Mon,in-person,"Phase 4 — Pilot, diagnosis, redesign",The diagnosis engine I: declare your design in code and interrogate it,"Before trusting your study, can you simulate it — and catch it failing?","What are diagnosands (bias, power, coverage)? How does declare→diagnose work as a loop? Why simulate a study you haven't run?",all (diagnosis engine),"""Simulated 1,000 times, my design shows bias ≈ B and power ≈ P for my inquiry — measured, not assumed.""","""My design is fine"" as a feeling. Untested designs have undiagnosed diseases.",RDSS ch. 10 'Diagnosing designs' (book.declaredesign.org); declaration_10.1; ch. 13 'Designing in code',,nb11 §1–2 (Colab),RDSS ch.10 + declaration_10.1.R + diagnosis_10.1.R | diagnosing designs | declare/diagnose loop translated to a compact Python helper | translated (R→Python),"design declaration in code; diagnosands: bias, power, coverage; Monte-Carlo diagnosis; the declare→diagnose loop","numpy/pandas (the course's inline declare_design/diagnose helpers, introduced here)","seeded Monte-Carlo diagnosis (1,000 runs) of a two-group design","0–5 M07 declarations returned with first-pass notes; 5–13 mini-lesson: the flight simulator argument — crash in simulation, not in the field; the three diagnosands; 13–20 pause-and-predict: our textbook design — biased or just noisy? commit before diagnosing; 20–35 hands-on: nb11 declare the design with the course helpers, run the 1,000-run diagnosis, read the diagnosand table; 35–46 lab: declare a SIMPLIFIED version of your own design (provided skeleton) and start its diagnosis; 46–50 exit ticket.","Declare a design in code, run a 1,000-replication diagnosis, and read bias/power/coverage off the result.",📝 nb11 practice: match 3 sick designs to their diseases (bias / low power / bad coverage) from their diagnosand tables.,Pilots train in simulators because crashes are cheap there. What is the research equivalent of a simulator crash — and of a real one?,Each student's simplified own-design declaration enters the diagnosis engine (M08 begins).,M08 — Design Diagnosis & Redesign Memo,11 min (own-design declaration skeleton),none (engine day),RDSS ch. 10 read; M07 declaration at hand.,Executed diagnosis of the textbook design + own declaration skeleton started,"Claim Ticket #23: the diagnosand my design most needs checked, and why.",Finish your own-design declaration cells; Wednesday we diagnose and REDESIGN it (RDSS ch. 11).,Stress-test the inline declare/diagnose helpers; keep runs ≤30s; prep the sick-designs cards.,"Helper code intimidates → students only FILL parameters (n, effect, noise), never write the machinery; machinery is narrated, not authored."
24,2026-10-21,Wed,in-person,"Phase 4 — Pilot, diagnosis, redesign",The diagnosis engine II: redesign — fix it before you run it,Your diagnosis found a weakness. What is the CHEAPEST change that fixes it?,"What can you redesign (n, measures, assignment, estimator)? How do you compare designs on a diagnosand? When is a question itself the thing to redesign?",all (diagnosis engine),"""Redesign R raises power from P1 to P2 at cost C — I compared designs, not vibes.""","Changing the QUESTION to whatever the weak design can answer, silently (that is a new declaration, not a redesign).",RDSS ch. 11 'Redesigning' (book.declaredesign.org); declaration_11.1,,nb11 §3–4 (Colab),RDSS ch.11 + declaration_11.1.R + diagnosis_11.x | redesigning | redesign-comparison loop translated | translated (R→Python),redesign levers; design comparison tables; cost-aware improvement; honest vs silent redesign,numpy/pandas (rerun diagnosis across parameter grids),seeded redesign grid over the M23 design + each student's own,"0–5 diagnosand-table cold reads (two volunteers read a table aloud correctly); 5–12 mini-lesson: the four redesign levers, each with its price tag; 12–25 hands-on: nb11 rerun the textbook design across a redesign grid, build the comparison table, pick the cheapest fix; 25–40 M08 STUDIO: diagnose YOUR design, apply one redesign, record before/after diagnosands (rotating consults); 40–47 REDESIGN PITCHES: each student, 60 seconds — my weakness, my fix, my before/after numbers; 47–50 exit ticket.",Build a redesign comparison table and defend the cheapest fix with before/after diagnosands.,"📝 nb11 practice: given a fixed budget, choose between doubling n and halving measurement noise — verify your choice by simulation.",When is shrinking your question the honest redesign — and how would a reader know you did it?,M08 memo takes form: each project now has diagnosed numbers and one committed redesign.,M08 — Design Diagnosis & Redesign Memo (presented; submit Fri Oct 23),15 min (own diagnose + redesign studio),M08 presented: 60-second redesign pitches with before/after diagnosands,Own-design declaration cells complete (Monday's homework); RDSS ch. 11 read.,Own before/after diagnosand table + delivered redesign pitch,"Claim Ticket #24: my design's diagnosed weakness and the fix I committed to, with numbers.","Write up and submit the M08 memo (diagnosis + redesign, with tables) by Fri Oct 23, 11:59 PM. Friday: prediction begins.",Consult order; verify grid runs stay fast; timer for pitches.,A student's design resists the simple helpers → instructor pair-declares it live in the consult; the memo may use the simplified stand-in with the simplification documented.
25,2026-10-23,Fri,in-person,"Phase 4 — Pilot, diagnosis, redesign","Prediction deep dive I: target, baseline, split — forecasting without fooling yourself",Can you forecast new cases better than the dumbest honest rule?,What is a prediction target? Why must a baseline come first? Why hold out data you never touch?,PREDICTION (deep dive),"""On held-out cases, my model beats the baseline by [margin] on [metric].""",Any performance number computed on data the model already saw — and any 'the model shows X matters' explanation talk.,(RDSS treats prediction lightly — this unit is built fresh; ch. 9 answer-strategy framing carries over),optional: callingbullshit.org — big-data/algorithm hubris case,nb12 §1–2 (Colab); scikit-learn (linked docs),fresh (scikit-learn) | prediction unit | target/baseline/split/metric protocol | fresh,prediction target; baseline rule; train/test split; metric choice; out-of-sample honesty,"scikit-learn (train_test_split, DummyClassifier, LogisticRegression), pandas",la_voter_file.csv (predict turnout from voter-file fields),"0–5 M08 submission check + why prediction is its own column (recall the 2×2); 5–13 mini-lesson: the prediction contract — target, baseline, split, metric, in that order; 13–20 pause-and-predict: what accuracy does the always-votes baseline get on this file? commit; 20–35 hands-on: nb12 build the baseline, beat (or fail to beat) it with a simple model, all scoring on held-out rows; 35–45 lab: IF your project has a predictive angle, define its target+baseline+metric; if not, write why prediction is the wrong column for your question (both are M09 prep); 45–50 exit ticket.","Score a dumb baseline honestly on held-out data, then try to beat it — and feel how hard honest beats easy.","📝 nb12 practice: choose the right metric for 3 targets (rare event, balanced classes, costly false negatives) and defend each.",The baseline got 78% and the fancy model got 80%. Write the honest headline — then the dishonest one you almost wrote.,M09 pilot prep: each project confirms or rules out its predictive component with reasons.,M09 — Pilot Analysis (approach-specific),10 min (own prediction-angle decision memo),none,M08 due tonight 11:59 PM; nothing else new.,Baseline-vs-model held-out comparison + own prediction-angle memo,Claim Ticket #25: my project's prediction verdict (has an angle / wrong column) in one defended sentence.,Read the nb12 leakage preview cell; Monday: how prediction goes wrong (leakage) and prediction ≠ explanation.,Verify la_voter_file predictive cells run fast; pre-compute the baseline so the reveal is snappy.,sklearn friction → all model code is provided; students only choose the target column and read outputs.
26,2026-10-26,Mon,in-person,"Phase 4 — Pilot, diagnosis, redesign","Prediction deep dive II: leakage, and why performance is not understanding",Your model scores brilliantly. What are the two most likely explanations — and why is 'it understands the world' third?,What is leakage and how does it sneak in? Why do good predictors make bad explainers? What does prediction contribute to a research argument?,PREDICTION (deep dive),"""My model forecasts held-out cases at [level]; I checked the features for leakage; I make no causal reading of its weights.""","""The model's top feature is X, so X drives the outcome"" — importance is not explanation, and leakage fakes importance.",(fresh unit continues),optional: callingbullshit.org — machine-bias / algorithm case,nb12 §3–4 (Colab),fresh (scikit-learn) | prediction unit | leakage demonstration built for the course | fresh,"leakage (target proxies, post-outcome features); the performance-understanding gap; prediction's honest role in research","scikit-learn, pandas (leaky vs clean feature sets)",la_voter_file.csv with one deliberately leaky feature engineered in,"0–5 recap bet: guess the leaky feature hiding in today's feature list; 5–12 mini-lesson: leakage taxonomy with two war stories; 12–27 hands-on: nb12 train on the leaky set (spectacular score), find the leak, retrain clean (honest score), write the delta; 27–36 pause-and-reflect: what SHOULD a researcher do with a great predictor (triage, targeting, hypothesis generation — not explanation); 36–46 M09 studio: pilot-analysis plans drafted, approach branch confirmed (rotating consults); 46–50 exit ticket.","Train on a leaky feature set, catch the leak, retrain clean, and report both numbers side by side.",📝 nb12 practice: 4 features for predicting hospital readmission — rank by leakage risk and justify.,An algorithm predicts who will miss probation appointments. List one legitimate use and one illegitimate use of exactly the same scores.,M09 pilot plans locked: every student knows which approach branch their pilot runs.,M09 — Pilot Analysis (approach-specific),10 min (pilot plan studio + consults),rotating instructor consults,nb12 §1–2 complete; prediction-angle memo from Friday.,Leaky-vs-clean comparison + locked pilot plan,"Claim Ticket #26: the leakage risk nearest MY project's data, and my check for it.",Read RDSS ch. 16 opener + skim declaration_18.1 context; Wednesday: causal reasoning proper.,Engineer the leaky feature so discovery is satisfying (findable in ~10 min); prep war stories.,"Leak found too fast → the notebook's second, subtler leak (temporal) is the extension path."
27,2026-10-28,Wed,in-person,"Phase 4 — Pilot, diagnosis, redesign","Causal reasoning deep dive I: counterfactuals, experiments, and what randomization buys",What would have happened WITHOUT the intervention — and how can anyone know?,Why is the counterfactual the heart of every causal claim? What exactly does randomization solve? What is an identification argument?,CAUSAL (deep dive),"""Because assignment was randomized (checked), the difference in outcomes estimates the causal effect, with stated uncertainty.""","A causal claim whose counterfactual is imagined rather than identified (""they improved after the program, so the program worked"").",RDSS ch. 18 'Experimental: causal' (book.declaredesign.org); declaration_18.1 (two-arm trial),,nb13 §1–2 (Colab),RDSS ch.18 + declaration_18.1.R + rdss foos_etal | experimental causal designs | two-arm trial translated; real GOTV experiment replicated descriptively | translated (R→Python),"counterfactuals (return of Y(1),Y(0)); randomization as counterfactual-maker; identification argument; the two-arm trial",numpy/pandas (analyze the foos_etal experiment; difference-in-means + interval),"foos_etal.csv (real get-out-the-vote field experiment, MIT-licensed replication data)","0–5 the 2×2 completed ceremonially — the last column's deep dive begins; 5–13 mini-lesson: the counterfactual problem and randomization's trick, replayed on the nb04 world; 13–20 pause-and-predict: in the real foos_etal experiment, did contact raise turnout? by how much? commit; 20–35 hands-on: nb13 analyze the real experiment — balance check, effect estimate, interval — then write its identification argument in 3 sentences; 35–45 lab: write YOUR project's identification paragraph (or the honest 'no identification available — my claim stops at association'); 45–50 exit ticket.",Analyze a real randomized field experiment end-to-end and write its 3-sentence identification argument.,"📝 nb13 practice: 3 claims — write the counterfactual each silently asserts, then grade its plausibility.","'The patients who took the drug did better.' Give the two non-causal stories, then say what randomization would have done to them.",Every project writes its identification paragraph — or its honest absence.,M09 — Pilot Analysis (approach-specific),10 min (own identification paragraph),none,RDSS ch. 16 opener + declaration_18.1 context skimmed; pilot plan locked.,Analyzed real experiment + own identification (or non-identification) paragraph,Claim Ticket #27: my project's causal status in one sentence: identified by ___ / honestly not identified.,"Pilot analyses due FRIDAY (M09, walkthrough day). Read RDSS ch. 16 DiD/RDD intuition sections.",Verify foos_etal loads + effect reproduces; prep the balance-check cell; office hours advertised for pilot crunch.,Pilot crunch panic → Friday's walkthrough accepts work-in-progress pilots; the submission deadline carries the polish.
