meeting,date,day,modality,unit,title,driving_question,secondary_questions,inquiry,srl_slot,srl_focus,claim_permitted,claim_not_permitted,rdss_reading,cb_reading,other_material,provenance,concepts,python_r_dependency,dataset_simulation,minute_dynamic,hands_on_activity,practice,discussion_prompt,project_connection,milestone_developed,milestone_work_time,milestone_presentation_review,student_prep,student_artifact,exit_ticket,homework_next_milestone,instructor_prep,risks_contingency
28,2026-10-30,Fri,in-person,Week 10 — Share the research and attack the analysis,"Studio Friday — poster draft 1 and research audit due: your analysis, attacked and defended","Your poster draft is on screen and your analysis has been audited. What survived the attack, and what did you change?",What does a completed research audit contain? What do the GenAI Studio Poster Critic and Robustness reviewers add to it? What will next week's poster criticism demand of this draft?,all positions (draft + audit),,,"""Here is my poster draft, the audit that stress-tested it, and the two things the AI critics changed my mind about — verified, not just accepted.""",Submitting a draft whose research audit is a formality — an audit with no hits either was not run honestly or was not run at all.,(no new reading — studio Friday; bring your poster draft and your robustness results),,"nb09 student notebook (attack the analysis) for the recap; M10 Brightspace brief (final poster lock); Purdue GenAI Studio — REQUIRED Poster Critic + Robustness & Sensitivity Reviewer roles, logged in the ledger; project/poster/redteam_review_protocol.md (four-audit slip); AI Research Ledger template",week's nb09 material + M10 Brightspace brief + GenAI Studio reviewer bench + project/poster/redteam_review_protocol.md | studio Friday | poster-draft review + required-role AI audit + poster-lock kickoff | fresh,the research audit as a graded artifact; required GenAI Studio Poster Critic + Robustness reviews; verifying AI critique before acting on it; the four-audit peer red-team; the poster-criticism and lock week ahead,none required (robustness results carried from the week),each student's own poster draft + audited analysis,"0–6 research stand-up: each student's one-line status on their poster draft and audit; 6–29 milestone kickoff + AI-supported sprint: present the M10 brief on Brightspace — the final poster lock and the criticism week that leads to it — then a sprint where every student runs the REQUIRED GenAI Studio Poster Critic and Robustness & Sensitivity Reviewer roles against their own draft and logs both in the ledger; 29–41 peer + AI red-team review: trade drafts, apply the four-audit red-team slip (claim boundary, figure honesty, read path, uncertainty), and compare what the peer caught against what the AI roles caught; 41–50 revise, log the ledger, submit M9 tonight + Claim Ticket.","Run the required GenAI Studio Poster Critic and Robustness reviews on your own draft, log them, then red-team a peer's draft with the four-audit slip and submit your poster draft plus research audit.","📝 during the sprint: for each required AI reviewer, write one hit you verified and acted on, and one you checked and rejected.",Where did the GenAI Studio Poster Critic and your human peer disagree about your draft — and whose hit did the data side with?,"M9 submits tonight; every project enters poster-criticism week with an audited draft and a documented, verified AI review trail.",M9 — Poster draft 1 and research audit (due tonight) → M10 — Final poster lock (kickoff),30 min studio block,M9 review: four-audit peer red-team + required GenAI Studio Poster Critic and Robustness reviews logged,Poster draft built and on screen; robustness and AI-review results from the week at hand.,Submitted poster draft + research audit + logged GenAI Studio Poster Critic and Robustness reviews + one peer red-team slip,"Claim Ticket #28: ""The one change the required AI reviews made to my poster — and the check that convinced me it was right, not just confident.""","Submit M9 tonight on Brightspace. Monday begins poster criticism — bring your draft ready to be walked, questioned, and defended before the Friday lock.",Confirm the GenAI Studio Poster Critic + Robustness roles are provisioned; print the four-audit red-team slips; M10 brief staged on Brightspace; consult order.,"GenAI Studio is down → the required reviews use each student's own draft run through saved role transcripts prepared in advance, and the live run is rescheduled to office hours; the ledger records the substitution."
29,2026-11-02,Mon,in-person,Week 11 — Poster criticism and final poster lock,"Poster criticism I: the gallery walk — audit every poster's questions, claims, evidence, uncertainty, and accessibility","Walking the room as a stranger would, does each poster's evidence actually earn its headline — and can everyone read it?","What does a gallery-walk audit check: the research question, the claims, the evidence hierarchy, the visible uncertainty, the visual design, the accessibility? Where do posters most often overclaim or exclude a reader? How do AI-generated skeptic questions sharpen a human critique?",all positions (poster criticism),SRL slot 17 — rotation seat B,"Puzzle: this poster's figure looks convincing from across the room, but does its impression match its number — and would a color-blind reader or a screen-reader user get the same message?","""On this poster, the headline is inside or outside its evidence, the uncertainty is visible or buried, and the design reaches or excludes these readers — here is the specific hit.""","A gallery-walk 'looks great' with no named hit — politeness is not a review, and a criticism round with no findings failed the poster, not spared it.",(no new RDSS chapter — poster-criticism week; the reading is project/poster/redteam_review_protocol.md and poster_rubric.md),,"nb10 student notebook (poster criticism and final lock), §1–2 (Colab); project/poster/redteam_review_protocol.md (four-audit slip); project/poster/poster_rubric.md (the five graded rows); Gemini for AI-generated skeptic questions per poster",project/poster/redteam_review_protocol.md + poster_rubric.md + fresh gallery-walk method | poster-criticism unit | four-audit gallery walk with AI-generated skeptic prompts | fresh,"the gallery-walk audit; the four audits (claim boundary, figure honesty, read path, uncertainty) plus visual design and accessibility; impression-versus-number; accessibility as a claim reaching every reader; AI-generated skeptic questions as a critique aid","none required (figure re-checks optional, matplotlib)",the class's own five poster drafts on display,"0–9 SRL-led research puzzle: the lead opens with one poster's figure and presses the room — does the visual impression match the actual number, and who cannot read it?; 9–31 structured gallery walk (the investigation block): every poster on display, each student walks all five with the four-audit slip plus a visual-design and accessibility check, and pastes Gemini-generated skeptic questions beside each to sharpen the critique; 31–43 human verification + instructor formalization: the room consolidates the hits per poster, separating real evidence-and-access problems from stylistic quibbles and checking each AI-generated question against the poster; 43–50 decision & defense: ledger entry + Claim Ticket.","Run a full gallery-walk audit of all five posters — claims, evidence, uncertainty, visual design, accessibility — sharpened by AI-generated skeptic questions you verify against each poster.","📝 nb10 practice: on a sample poster with planted flaws, catch at least one claim-boundary, one figure-honesty, and one accessibility problem; mark which AI-generated skeptic question would have surfaced each.",Which accessibility problem did the gallery walk catch that a fast reader never would — and how many strangers at the Expo would it have lost?,M10 final poster lock advances: each project leaves with a consolidated list of audited hits and the AI-generated hard questions its poster must answer.,M10 — Final poster lock,8 min (log the audited hits your own poster received),gallery-walk audit (structured peer criticism of every poster),M9 poster draft on display; four-audit slip and rubric reviewed.,Completed gallery-walk audit slips given + the consolidated hit list for your own poster,"Claim Ticket #29: ""The gallery walk's most serious hit on my poster is [hit]; it threatens my claim boundary, uncertainty, or accessibility, and my fix is [x].""","Apply the gallery-walk hits to your poster; Wednesday you defend it out loud against interdisciplinary, methods, and skeptical-reviewer questions before Friday's lock.",Mount all five drafts for the walk; print the four-audit + accessibility slips; verify the Gemini skeptic-question prompts produce usable output; brief the SRL on the impression-vs-number puzzle.,A draft is not display-ready → that student audits others (the obligation stands) and posts their storyboard grid in its place for critique.
30,2026-11-04,Wed,in-person,Week 11 — Poster criticism and final poster lock,"Poster criticism II: the oral defense — face interdisciplinary, methods, and skeptical-reviewer questions","Standing at your poster, can you answer the outsider, the methodologist, and the skeptic — and concede gracefully where you must?",How does an interdisciplinary question differ from a methods question or a skeptic's? What does a strong 'I don't know' contain? When do you defend and when do you concede? How does the oral defense expose gaps the written poster hid?,all positions (oral poster defense),SRL slot 18 — rotation seat C,"Puzzle: a skeptic asks 'couldn't something else explain this?' and a methods reviewer asks 'why this specification?' — do they take the same answer, or do they need different defenses?","""Asked as an outsider, a methodologist, and a skeptic, I defended what my evidence licenses and conceded what it does not — on the record, at the poster.""",Bluffing an answer you do not have or upgrading the claim under pressure — the spoken defense must stay inside the poster's written boundary.,"(no new RDSS chapter — poster-criticism week; the reading is project/poster/redteam_review_protocol.md, oral-defense section)",,"nb10 student notebook (poster criticism and final lock), §3 (Colab); project/poster/redteam_review_protocol.md; a three-lens question deck (interdisciplinary / methods / skeptic); Gemini for generating additional hard questions per poster",project/poster/redteam_review_protocol.md (oral-defense adaptation) + fresh three-lens question protocol | poster-criticism unit | oral defense rounds with interdisciplinary/methods/skeptic questioning | fresh,oral poster defense; interdisciplinary vs methods vs skeptical questions; the honest-don't-know formula; defend-versus-concede judgment; the spoken claim boundary,none required (defender may open the notebook if a number is probed),each student's own poster (defended live),"0–7 SRL-led retrieval & challenge: the lead sorts three sample questions into interdisciplinary, methods, and skeptic, and challenges the class on which needs which kind of answer; 7–30 intensive oral-defense rounds: each presenter stands their poster for a timed round of questions drawn from all three lenses (peers, instructor, and Gemini-generated skeptic prompts), practicing the honest-don't-know formula; 30–42 peer defense + adversarial questioning: in pairs, drill the hardest unanswered question from each defense and rehearse the defend-or-concede call; 42–50 transfer to Friday's lock + ledger + Claim Ticket.","Defend your poster live against interdisciplinary, methods, and skeptical questions, then drill the hardest question each defense exposed and decide where to defend and where to concede.",📝 nb10 practice: classify six audience questions by lens (interdisciplinary / methods / skeptic) and draft the honest-don't-know answer for the one you would least like to get.,"Which classmate's concession made their project MORE credible, not less — and what exactly did they concede?",M10 nears lock: every project has faced live questioning across three lenses and knows the exact claims it must soften before Friday.,M10 — Final poster lock,16 min (revise the claims your oral defense exposed as too strong),oral poster defense rounds (three-lens questioning),Gallery-walk hits applied; poster ready to stand and defend; question bank started.,Delivered oral defense + logged hardest questions + the list of claims to soften before the lock,"Claim Ticket #30: ""The question I could not fully answer today is [q]; before Friday's lock I will answer it or soften the claim it exposed.""","Make every claim-softening your defense exposed; Friday is the terminal production studio — arrive with a print-ready file, because the poster locks and goes for printing that day, with no revision after.",Assemble the three-lens question deck per project; timer; verify the Gemini hard-question prompts; brief the SRL on the two-kinds-of-question puzzle.,"A defense stalls → the instructor steps in as question-asker-of-record, slows the cadence, and the presenter gets a second short round after watching a peer model a save."
31,2026-11-06,Fri,in-person,Week 11 — Poster criticism and final poster lock,"Studio Friday — final production and poster lock: citations verified, claims traced, submitted for printing by 5:00 PM","Is every claim on this poster one you can defend to a stranger at the Expo, every number traced to a cell, every source real — with no 'after' to fix it?","Does every citation resolve to a real, retrievable source? Does every claim trace to its evidence and sit inside its boundary? Is the AI-use disclosure block complete? Is the file print-ready to URC spec?",all positions (production and lock),,,"""Locked: every number traces to a notebook cell, every citation resolves to a real source, every claim sits inside its boundary, and the AI-use disclosure is on the record.""","""I'll fix it after submission"" — there is no after; the poster is terminal and the Expo audience reads the submitted version.","(no new reading — studio Friday; bring your print-ready poster file and your notebook, runnable)",,"nb10 student notebook (poster criticism and final lock), §4 final checklist (Colab); project/poster/production_checklist.md; project/poster/poster_rubric.md (self-score); the course citation-verification discipline (every source retrieved and confirmed); URC poster spec + submission instructions on Brightspace",project/poster/production_checklist.md + poster_rubric.md + course evidence-integrity discipline | studio Friday (terminal) | final production checklist + citation/claim/disclosure audit + poster lock | fresh,citation verification (every source real and retrievable); claim–evidence traceability (every number to a cell); the AI-use disclosure block; print-spec compliance; the terminal lock,none required (figure re-exports at print resolution as needed),each student's own final poster + runnable notebook,"0–6 research stand-up: each student's one-line readiness call (what is left before the file locks); 6–29 final production sprint: silent studio with rotating instructor checklist consults — print-spec, figure resolution, uncertainty visible, headline inside its boundary — while each student runs the citation-verification pass (every source retrieved and confirmed) and completes the AI-use disclosure block; 29–41 final-lock checklist audit pairs: partners trade posters and run three audits — citation verification, claim–evidence traceability (one number shown to its notebook cell), and disclosure-block completeness — initialing each; 41–50 lock, submit for printing, close the ledger + Claim Ticket. The deadline is today, 5:00 PM.","Run the final checklist, verify every citation resolves to a real source, trace one number to its cell under a partner's eyes, complete the AI-use disclosure, and submit the poster for printing.",📝 (embedded in the checklist) verify: fonts ≥ minimum size at print scale; every figure carries its uncertainty or caveat; every citation opens to the source it names.,"(brief, during consults) Which audit almost caught you — a citation that did not resolve, a number that did not trace, or a claim that outran its evidence?",M10 final poster LOCKED and submitted for printing — the URC artifact is terminal; everything after this is delivery and depth (M11 kicks off Monday).,"M10 — Final poster lock (LOCKED + submitted for printing by 5:00 PM, terminal — no revision)",30 min studio block (production sprint + audit pairs),instructor checklist consults + pair citation/claim/disclosure audit,All oral-defense claim-softenings applied; print-ready file staged; notebook runnable.,Locked poster submitted for printing + signed production checklist + citation-verification + claim-traceability + disclosure audit,"Claim Ticket #31: ""One claim I softened before the lock, and why the softer version is the one I can defend at the Expo.""","Rest this weekend — the poster is locked. Monday begins poster delivery: the pitches, spoken uncertainty, and hard questions that turn this poster into a performance (M11).",Confirm the printing/portal submission mechanics; consult-rotation timer; backup PDF-to-Brightspace plan; the M11 delivery brief staged for Monday.,"Printing or the portal fails → the PDF submitted to Brightspace timestamps the 5:00 PM deadline; physical printing resolves next week before the Expo. A citation will not resolve → the claim it supports is cut or re-sourced before the lock, never shipped unverified."
32,2026-11-09,Mon,in-person,Week 12 — Poster delivery,"Poster delivery I: the 30-second, 90-second, and full pitch — compression without inflation","A stranger gives you thirty seconds, then maybe three minutes. What do you say in each, and how do you keep every version honest?","How do the 30-second, 90-second, and full pitches differ in job? How do you explain your method without jargon? Where does the claim boundary live when you are speaking, not writing?",all positions (communication),SRL slot 19 — rotation seat D,"Puzzle: two visitors stop at the same poster for a few seconds each — one leaves intrigued, one leaves confused. What did the first ten words do differently?","""In my sample, X was associated with Y — spoken exactly as the poster says it, compressed but never upgraded.""","""X causes Y"" said aloud at the poster when the poster only claims association (the excited-mouth upgrade).",(no new reading — delivery unit; bring your final poster and your inquiry declaration boundary),,nb11 student notebook (poster delivery) §1–2 (Colab); project/conference/presentation_plan_protocol.md; M11 brief on Brightspace,presentation_plan_protocol.md + fresh pitch architectures | delivery unit | 30-sec / 90-sec / full-pitch scripts + jargon audit | fresh,"pitch architecture (hook, claim, evidence, boundary, invitation); the 30-second hook vs the 90-second walk vs the full 3-to-5-minute version; audience adaptation; explaining method without jargon; compression-never-inflation",none,each student's own poster,"0–9 SRL-led research puzzle: the lead plays two visitors at one poster (a few-second stopper and a three-minute stayer) and the room names what the opening ten words must do differently for each; 9–31 guided Gemini research-partner investigation: draft your three pitch layers with Gemini as a rehearsal partner — the 30-second hook, the 90-second walk, the full pitch — then have Gemini flag every sentence that upgrades a claim or hides behind jargon; 31–43 human verification + instructor formalization: you check each Gemini flag against your poster's boundary yourself (Gemini proposes, you verify), and the instructor formalizes the pitch architecture — hook, claim, evidence, boundary, invitation — and the compression-never-inflation rule; 43–50 decision & defense: log the delivery decisions and their verification in the ledger and write the Claim Ticket.","Draft and deliver all three pitch layers (30-second, 90-second, full), and catch a partner's spoken claim-upgrades and jargon.",📝 nb11 practice: compress one evidence block into a single spoken sentence at three lengths without inflating the claim; rewrite one jargon sentence in plain words a stranger outside your field would follow.,"Where in a classmate's pitch did a technical word do real work, and where was it a wall a visitor could not climb?","M11 (presentation package) begins: your three pitch layers are its first component, all sized to the poster you already locked.",M11 — Presentation Package,15 min (scripting the three pitch layers),partner delivery rounds with upgrade-and-jargon flagging,Final poster content internalized; headline claim sayable cold; inquiry declaration boundary at hand.,Three drafted pitch layers with the boundary sentence marked + partner feedback,"Claim Ticket #32: my boundary sentence, exactly as I will say it out loud.",Rehearse all three pitch layers aloud. Lecture 2 builds the harder half of delivery — spoken uncertainty and the difficult questions you fear.,Rehearse the well-said / inflated pitch demo pair; print the pitch-architecture templates; stage the M11 brief on Brightspace.,"Stage fright surfaces → the two-attempt structure makes everyone's first delivery officially a draft, and solo rehearsal is offered in office hours."
33,2026-11-11,Wed,in-person,Week 12 — Poster delivery,"Poster delivery II: uncertainty spoken like a scientist, and the hard question you fear",Can you say what your study cannot show — and answer the hardest fair question — without either bluffing or apologizing your findings away?,"What does an honest 'I don't know' contain? How do you separate evidence from speculation out loud? When a visitor asks 'but does it CAUSE it?' about a noncausal project, what do you say?",all positions (communication),SRL slot 20 — rotation seat E,Puzzle: a stranger asks 'so does it CAUSE it?' about a study that only measured association — what is the one sentence that stays honest and still keeps them interested?,"""I don't know — but here is what I do know that bears on it, and here is how one would find out.""",Bluffing an answer you do not have — the one move that can destroy a presenter's credibility on the spot.,(no new reading — delivery unit; bring your uncertainty line and your poster's claim boundary),,nb11 student notebook (poster delivery) §3–4 (Colab); project/conference/uncertainty_limitations_protocol.md; project/conference/hard_questions_protocol.md; M11 brief on Brightspace,uncertainty_limitations_protocol.md + hard_questions_protocol.md | delivery unit | ULN move + five-type question bank + honest-don't-know formula | fresh,"the uncertainty-limitations-next-step (ULN) move; the five hard-question types (method, alternative explanation, so-what, generalization, AI-use); the honest-don't-know formula; separating evidence from speculation; defend-vs-concede judgment; professional conference interaction",none,"each student's own findings, spoken","0–7 SRL-led retrieval & challenge: the lead fires a causal question at a deliberately noncausal finding ('so it CAUSES it?') and the room drafts the one sentence that stays honest and keeps the visitor interested; 7–30 intensive applied AI laboratory: build your five-question bank (one per type) with Gemini generating hostile-but-fair versions you did not think of, draft the ULN paragraph and the honest-don't-know answer for the worst one, then deliver your ULN to two partners in rotation; 30–42 peer defense + adversarial questioning: sit a 3-minute hot seat drawn from your bank plus surprises while classmates probe, defending from the ledger or conceding cleanly; 42–50 transfer + ledger + Claim Ticket: revise the bank from what the hot seat exposed, log the AI-use decision and its verification, and write the ticket.","Survive a 3-minute hot seat on your five-question bank, delivering the ULN move and at least one honest 'I don't know' without bluffing.","📝 nb11 practice: convert three apology-spiral sentences into ULN form; for one causal question aimed at a noncausal finding, write the two-sentence honest reply.","Which classmate's hot-seat save impressed you most, and what exactly did they do to turn a stumble into a grounded answer?",M11 completes its intellectual armor: the pitch layers plus the uncertainty statement and question bank are the package you carry to the Expo.,M11 — Presentation Package (uncertainty statement + question bank),15 min (bank-building + ULN drafting),hot-seat rounds + ULN partner rounds with strength-not-apology scoring,Pitch layers rehearsed from Lecture 1; findings and their limits at hand.,Five-question bank + ULN paragraph + hot-seat performance,"Claim Ticket #33: the question I most fear at the Expo, and my first sentence in reply.","Finish M11 (three pitch layers + uncertainty statement + question bank) for Friday's studio, where the mock poster symposium drills it and M11 is due that night.",Surprise-question deck per project; three ULN demos including a null finding; timer for the hot seats.,"A hot seat runs hot emotionally → the instructor becomes questioner-of-record and slows the cadence; the drill's purpose, safety through practice, is named aloud."
