meeting,date,day,modality,unit,title,driving_question,secondary_questions,inquiry,srl_slot,srl_focus,claim_permitted,claim_not_permitted,rdss_reading,cb_reading,other_material,provenance,concepts,python_r_dependency,dataset_simulation,minute_dynamic,hands_on_activity,practice,discussion_prompt,project_connection,milestone_developed,milestone_work_time,milestone_presentation_review,student_prep,student_artifact,exit_ticket,homework_next_milestone,instructor_prep,risks_contingency
1,2026-08-24,Mon,in-person,Week 1 — Research in the age of AI,"Your arm and your research assistant, not your brain: the course promise and a live citation-catch",What does research even mean when an AI can generate the code and the prose for you?,"What will you build this semester? Where is the line between AI assistance and intellectual substitution? What does 'AI may propose, the researcher must verify' demand of you on day one?",all positions (course framing),,,"""An AI tool generated this, and I confirmed the underlying source exists before I used it"" — the course's opening standard.","""The AI said so"" offered as evidence — a generated citation you have not retrieved and checked is not yet a source.",RDSS ch. 1 (Preface) + ch. 2 'What is a research design?' — skim before Wednesday (book.declaredesign.org),,nb00 (Colab); course website; syllabus; Brightspace orientation; genai.rcac.purdue.edu login,brief §Week1 + RDSS ch.2 | research in the age of AI | course promise + live Gemini citation-catch + Colab/GenAI Studio readiness | newly-constructed-from-source-concept,"evidence-driven research; AI as arm and research assistant, not brain; assistance vs intellectual substitution; hallucination; the AI Research Ledger (preview); Ask -> Verify -> Document (the everyday form of SDIIVDD); the weekly rhythm (lectures + Friday studio)","Colab basics only (run a cell, save a copy to Drive)",none (one live AI-generated citation to verify),"0–9 instructor-led puzzle: what is left for a researcher to do once an AI can write the code and the prose? — the class maps the answer on the board; 9–31 guided Gemini research-partner investigation in nb00: ask Gemini for three sources on a shared question and open each one, watching one citation fail to resolve; 31–43 human verification + instructor formalization: run the failed citation through the verification checklist, name hallucination and the arm-not-brain principle, and set up the AI Research Ledger; 43–50 decision & defense: log the caught citation as the first Ledger entry + Claim Ticket.","Open nb00 in Colab, save a copy to Drive, ask Gemini for sources on a shared question, and catch the one citation that will not resolve using the verification checklist.","📝 nb00 practice: for three AI-generated claims, mark which you could defend right now and which need a source you would have to retrieve first.","When has a confident answer, from a person or a tool, turned out to be wrong for you — and what would have caught it earlier?","The semester project starts today: everyone leaves set up in Colab, logged into the course tools, and holding the M0 baseline assignment.",M0 — Research and AI baseline (kickoff),5 min (M0 brief walkthrough + first baseline-belief jotting),none (kickoff),"Bring a laptop; be able to log into Google (Colab), Brightspace, and genai.rcac.purdue.edu.",Executed nb00 readiness cells + first AI Research Ledger entry (the caught citation),"Claim Ticket #1: one thing you assume AI is good at in research, and how you would check whether it actually is.","Start M0 (baseline beliefs about AI, three curiosities, tool-readiness screenshots, first Ledger entries) — due at this Friday's studio, where you pitch one curiosity in 30 seconds. Skim RDSS ch. 1–2 before Wednesday.",Verify nb00 loads in Colab from the public repo; rehearse the live Gemini citation-catch and keep an offline screenshot backup; confirm GenAI Studio logins work; roster the 5 students.,Gemini returns only valid citations in the live demo → fall back to the saved transcript of a prior hallucination and have the class verify it; account/Colab issues → pair on one laptop and finish readiness at home.
2,2026-08-26,Wed,in-person,Week 1 — Research in the age of AI,"Automation bias, false confidence, and the first full Ask -> Verify -> Document cycle","Why do smart people trust a wrong machine, and what discipline keeps you from joining them?",What is automation bias? How does fluent AI prose manufacture false confidence and the illusion of understanding? Which research decisions must stay human? What are the seven moves of Specify -> Delegate -> Interrogate -> Inspect -> Verify -> Document -> Defend?,all positions (course framing),,,"""I delegated this step, interrogated the output, and verified it against a source I can point to"" — a claim that survives the full cycle.","""It sounded right and detailed, so I used it"" — fluency is not evidence, and detail is not verification.",RDSS ch. 2 'What is a research design?' (finish; book.declaredesign.org),,nb00 §Lecture 2 (Colab); the AI Research Ledger template,brief §Week1 + RDSS ch.2 | research in the age of AI | automation-bias framing + first full SDIIVDD cycle on a toy claim | newly-constructed-from-source-concept,automation bias; false confidence; the illusion of understanding; assistance vs substitution; research ownership + human decision authority; the never-delegate list; SDIIVDD (Specify -> Delegate -> Interrogate -> Inspect -> Verify -> Document -> Defend) and its shorthand Ask -> Verify -> Document; the AI Research Ledger fields,Colab (run provided cells; no new libraries),none (one toy factual claim carried through the full cycle),"0–7 instructor-led retrieval & challenge: name yesterday's arm-not-brain principle and one decision an AI must never make for you; 7–30 intensive applied AI laboratory: take one toy claim through all seven SDIIVDD moves in nb00 — specify the task, delegate it to Gemini, interrogate and inspect the output, then verify it against a real source and document the Ledger row; 30–42 peer defense + adversarial questioning: partners try to break each other's verification (""how do you KNOW the source says that?""); 42–50 transfer to the final project + Ledger + Claim Ticket.","Run one toy claim through all seven SDIIVDD moves in nb00 and fill a complete AI Research Ledger row, ending with a source you personally opened.","📝 nb00 practice: match five research tasks to 'safe to delegate', 'delegate then verify', or 'never delegate', and justify each in a phrase.","Describe a time a detailed, confident explanation made you stop checking. What would automation bias look like in your own project?",The Ledger row you complete today is the template for every AI use you will document in the project dossier.,M0 — Research and AI baseline (dev),5 min (draft one real Ledger entry from your own AI use this week),none (baseline is a studio submission),M0 in progress (baseline beliefs + curiosities started); RDSS ch. 2 skimmed; laptop ready.,"One complete AI Research Ledger row (task, tool, prompt, output, decision, verification, remaining concern)","Claim Ticket #2: one AI output you trusted this week, and the exact check that would confirm or break it.","Finish M0 (baseline AI beliefs, three curiosities, tool-readiness screenshots, first Ledger entries) for this Friday's studio, where you pitch one curiosity in 30 seconds.",Prepare the toy-claim cycle end-to-end in nb00; print the SDIIVDD and never-delegate cards; review any early M0 drafts.,The cycle runs long → verify and document the toy claim together as a class and move peer defense to a written exchange; keep the never-delegate list visible as the anchor.
3,2026-08-28,Fri,in-person,Week 1 — Research in the age of AI,"Studio Friday — AI baselines and first curiosities: M0 due, M1 kickoff","Can you name what you assume about AI, pitch a curiosity in 30 seconds, and leave with a plan to map a research opportunity?","What did your baseline reveal about where you over-trust AI? What does the M1 brief ask for (a research opportunity landscape), and how is it graded?",all positions (studio),,,"""Here is a curiosity worth a semester, and here is what I assume AI can and cannot do for it"" — the M0 baseline claim.","""AI will just do the research for me"" — a baseline belief the whole course is built to correct.",(no new reading — studio Friday; bring your completed M0 baseline and a 30-second curiosity),,nb00 student notebook (research in the age of AI) — recap reference (Colab); M1 Brightspace brief,course design (Friday studio format) | weekly Friday studio | recap + M1 milestone brief + supervised sprint | newly-constructed-from-source-concept,surfacing AI-trust assumptions; the 30-second curiosity pitch; the M1 deliverable (research opportunity landscape); research stand-up norms; supervised project work,none new (own milestone work),student's own baseline + curiosity materials,"0–6 research stand-up: each student reports one change, one blocker, one decision, one thing delegated to AI, and one thing that still needs verification; 6–29 milestone kickoff from the Brightspace brief: present M1 (research opportunity landscape) + rubric, then an AI-supported sprint — 30-second curiosity pitches, then use Gemini to widen each curiosity into candidate problem areas while logging every prompt; 29–41 peer + AI red-team review: classmates and a Gemini skeptic pass each pitch back one 'so what?' and one place the AI over-promised; 41–50 revise, update the Ledger + dossier, submit M0 + Claim Ticket.","Deliver a 30-second curiosity pitch, then use Gemini to widen it into candidate problem areas, logging and verifying each suggestion in the Ledger.","📝 studio log: record one AI suggestion you kept, one you rejected, and the reason for each.","Whose 30-second curiosity would you follow for a semester, and what is the first thing you would need to know to start?",M0 closes today; the candidate problem areas widened in the sprint open the M1 opportunity landscape.,M0 — Research and AI baseline (presented + due); M1 — Research opportunity landscape (kickoff),23 min studio block,"M0 presented: 30-second curiosity pitch + whole-class stand-up, each pitch gets one 'so what?' and one AI-overreach flag","M0 complete (baseline, curiosities, tool-readiness screenshots, Ledger entries); 30-second pitch ready; laptop ready.",Delivered pitch + a first M1 candidate-problem-area list with a verified Ledger trail,"Claim Ticket #3: my strongest curiosity in one sentence, plus one thing I will NOT let AI decide about it.",Submit M0 tonight (11:59 PM). Weekend: skim RDSS ch. 4 'Getting started'; grow your candidate problem areas toward the M1 opportunity landscape (due at next Friday's studio).,Queue the stand-up and pitch order; M1 Brightspace brief on screen; warm-feedback + red-team norms posted; consult rotation list.,Stand-ups run long → cap each at 45 seconds with a visible timer and protect the sprint block; a student has no viable curiosity → offer the curated fallback-topic menu and book an office-hours consult.
4,2026-08-31,Mon,in-person,Week 2 — From curiosity to a research problem,"From curiosity to a research problem: the funnel, and what makes a problem worth doing",How does a curiosity become a research problem someone would fund a semester of your life to study?,"What separates a topic from a research problem from a question? What do importance, feasibility, and contribution each demand? What are units of analysis, target populations, and outcomes?",all positions (framing the problem),SRL slot 01 — rotation seat A,Puzzle: two students bring the same broad interest but only one has a research problem — what did the second one add that the first did not?,"""My problem names its units, its outcome, and the population it speaks to, and I can say why it matters and why it is doable this semester.""","""My topic is important, so any question about it is a research problem"" — a topic is a subject, a problem is a specific gap someone could act on.",RDSS ch. 4 'Getting started' (book.declaredesign.org),,nb01 §Lecture 1 (Colab),RDSS ch.4 + fresh curiosity->problem funnel | getting started | curiosity->topic->problem->question funnel + importance/feasibility/contribution + units/population/outcome scaffold | extended,"curiosity vs topic vs research problem vs question; the funnel; importance, feasibility, contribution; units of analysis; target population; outcome and target; studyability",none beyond running markdown/code cells,none (worked funnel examples + own-topic cards),"0–9 SRL-led research puzzle: two students' broad interests side by side, only one already a research problem — the class names what the second added; 9–31 guided Gemini research-partner investigation in nb01: run your curiosity down the funnel, asking Gemini to surface candidate units, populations, and outcomes, then verify each suggestion against a real source; 31–43 human verification + instructor formalization: the instructor formalizes topic vs problem vs question and the importance/feasibility/contribution test, and the class corrects one over-eager AI suggestion; 43–50 decision & defense: log the funnel decisions in the Ledger + Claim Ticket.","Run your curiosity through the nb01 funnel to a candidate problem, using Gemini to propose units, populations, and outcomes and verifying each before you keep it.","📝 nb01 practice: sort six statements into curiosity / topic / problem / question, then name the units, population, and outcome hiding in one of them.","When is 'this matters to everyone' a strength for a research problem, and when is it a warning that the problem is not yet specific?","The funnel output — a candidate problem with units, population, and outcome — is the spine of the M1 opportunity landscape.",M1 — Research opportunity landscape (dev),7 min (funnel your own curiosity to a candidate problem),SRL-led puzzle debrief (no formal presentation),M0 submitted; a curiosity in hand; RDSS ch. 4 skimmed; laptop ready.,"Own curiosity funneled to a candidate problem with units, population, and outcome named in nb01","Claim Ticket #4: my curiosity restated as a research problem, naming its units, its outcome, and who it is about.",Grow the M1 opportunity landscape (candidate problems with importance/feasibility/contribution notes). Skim the opening of RDSS ch. 7 before Wednesday.,Brief SRL seat A on the two-interest puzzle; queue the worked funnel example; verify nb01 loads in Colab; review M0 submissions.,A student cannot narrow past a topic → co-run the funnel live on their topic as the shared example; SRL under-prepared → the instructor holds the puzzle and the SRL takes the transfer block.
5,2026-09-02,Wed,in-person,Week 2 — From curiosity to a research problem,"The inquiry compass: descriptive, predictive, or causal — kind x reach","What KIND of answer does your question ask for, and how far is it trying to reach?","How do descriptive, predictive, and causal questions differ? Why is prediction a descriptive question about unseen cases, not a causal one? What goes wrong when a single question tries to do two jobs at once?",all four compass positions (the compass skill),SRL slot 02 — rotation seat B,"Puzzle: one question secretly asks two things at once (what is happening AND what would fix it) — where does it split, and which half is which kind?","""My question is a ___ inquiry reaching ___ (data at hand / a population / unseen cases), because the answer it wants is ___.""","A question that fuses description and causation in one breath (""how common is burnout and does remote work cause it?"") pretending to be a single answerable question.",RDSS ch. 7 'Defining the inquiry' (descriptive vs causal inquiries; book.declaredesign.org),optional: callingbullshit.org case on prediction vs understanding,nb01 §Lecture 2 (Colab),RDSS ch.7 + fresh compass build | defining the inquiry | kind x reach compass with the prediction column authored fresh (descriptive about unseen cases) | extended,"the inquiry compass: kind (descriptive vs causal) x reach (data at hand / population / unseen); the four positions — description, generalization, prediction, causal reasoning; prediction as descriptive questions about unseen cases; questions that improperly combine objectives; the giveaway words that place a question",none (classification in markdown cells),none (question cards spanning the compass),"0–7 SRL-led retrieval & challenge: name the compass axes from memory, then the SRL reveals one question that secretly asks two things; 7–30 intensive applied AI laboratory: in nb01, classify a deck of question cards by kind and reach, then ask Gemini to classify the same cards and adjudicate every disagreement against the definitions; 30–42 peer defense + adversarial questioning: classify YOUR own question and defend its position while a partner tries to move it; 42–50 transfer to the final project + Ledger + Claim Ticket.","Classify a deck of question cards by kind and reach, pit your classification against Gemini's, and resolve every disagreement with the definitions — then place your own question.","📝 nb01 practice: for eight questions, name the kind + reach AND rewrite the one that improperly combines two objectives into two clean questions.","Why is 'predicting who will drop out' a descriptive question about unseen cases and not a causal one, and what would make it causal?","Each student leaves with a first compass position for their own question, recorded in the M1 landscape.",M1 — Research opportunity landscape (dev; compass position added),6 min (classify own question by kind + reach; note it in the landscape),peer defense: partner tries to reclassify your question,Candidate problem from Monday; RDSS ch. 7 opening skimmed; laptop ready.,A classified question deck + own question placed on the compass in nb01,"Claim Ticket #5: my question is (for now) a ___ inquiry reaching ___, and the giveaway word that places it there.",Finish the M1 opportunity landscape (problems + compass positions + importance/feasibility/contribution) for this Friday's studio. Confirm your Purdue Libraries login works before next week.,Brief SRL seat B on the double-barreled-question reveal; print the question-card deck spanning all four positions; queue the optional CB case.,The compass lands abstract → anchor each position to one shared running example the class knows; AI classification agrees too easily → seed two deliberately ambiguous cards to force the adjudication.
6,2026-09-04,Fri,in-person,Week 2 — From curiosity to a research problem,"Studio Friday — Opportunity landscapes: M1 due, M2 kickoff","Does your research opportunity landscape hold up — real problems, honest feasibility, a clear compass position — and can you pitch the one you will pursue?","Which of your candidate problems is most worth doing? What does the M2 brief ask for (verified evidence and a contribution map), and how is it graded?",all four compass positions (studio),,,"""Across my candidate problems, this one is important, feasible, and a real contribution, and its compass position is ___.""","""Every problem on my landscape is equally strong"" — a landscape with no ranking has not been appraised.",(no new reading — studio Friday; bring your M1 opportunity landscape),,nb01 student notebook (curiosity -> problem) — recap reference (Colab); M2 Brightspace brief,course design (Friday studio format) | weekly Friday studio | recap + M2 milestone brief + landscape review sprint | newly-constructed-from-source-concept,ranking candidate problems by importance/feasibility/contribution; committing to a lead problem; the M2 deliverable (verified evidence + contribution map); research stand-up; red-team review,none new (own milestone work),student's own project materials,"0–6 research stand-up: each student reports change, blocker, decision, delegation, and what still needs verification; 6–29 milestone kickoff from the Brightspace brief: present M2 (verified evidence + contribution map) + rubric, then an AI-supported sprint — pitch your landscape, pick a lead problem, and use Gemini to surface where evidence for it might live while logging each lead to verify next week; 29–41 peer + AI red-team review: the class and a Gemini skeptic challenge each lead problem's feasibility and compass position; 41–50 revise, update the Ledger + dossier, submit M1 + Claim Ticket.","Pitch your opportunity landscape, commit to a lead problem, and use Gemini to map where evidence for it might live — logging every lead as unverified until you retrieve it.",📝 studio log: record the lead problem you committed to and the single feasibility risk that most threatens it.,"Which classmate's lead problem would you switch your own project to, and what makes it feel doable in one semester?",M1 closes today; the lead problem and evidence leads from the sprint open the M2 verified-evidence map.,M1 — Research opportunity landscape (presented + due); M2 — Verified evidence and contribution map (kickoff),23 min studio block,M1 presented: landscape pitch + class red-team on feasibility and compass position,M1 opportunity landscape complete; Purdue Libraries login working; laptop ready.,"Committed lead problem + a first list of evidence leads to verify, with a Ledger trail","Claim Ticket #6: the one problem I am committing to, its compass position, and why it is doable this semester.",Submit M1 tonight (11:59 PM). Next week has a single lecture — no class Monday for the holiday. Weekend: read RDSS ch. 4 on situating a design in a literature and confirm your Purdue Libraries access.,Queue stand-up + pitch order; M2 Brightspace brief on screen; red-team norms posted; consult rotation.,Landscapes are thin → pair students to pressure-test the stronger landscape and assign the thin one a fallback problem from the menu; pitches overrun → cap red-team responses at one written note each.
