meeting,date,day,modality,unit,title,driving_question,secondary_questions,inquiry,srl_slot,srl_focus,claim_permitted,claim_not_permitted,rdss_reading,cb_reading,other_material,provenance,concepts,python_r_dependency,dataset_simulation,minute_dynamic,hands_on_activity,practice,discussion_prompt,project_connection,milestone_developed,milestone_work_time,milestone_presentation_review,student_prep,student_artifact,exit_ticket,homework_next_milestone,instructor_prep,risks_contingency
13,2026-09-23,Wed,in-person,Week 5 — Observational descriptive research,"Reading an observational description: measurement, missingness, and the generalization boundary","Once the data are in, how do you summarize them honestly, and how far past your sample may the summary reach?","How do nonresponse and missingness bend a description? What do distributions, relationships, and indices each reveal? When does a sample description become a population claim, and what licenses that crossing?","Generalization — descriptive kind · population reach (observational pathway, Lecture 2)",SRL slot 07 — rotation seat B,"Puzzle: a survey with 40% nonresponse reports a precise national estimate — what license is missing, and what would restore it?","""Given what my frame and response rate allow, the population estimate is [value] with stated uncertainty and named coverage limits.""","""The average in my respondents is the population average"" when nonresponse is related to the very thing being measured.","RDSS ch. 15 'Observational: descriptive' (book.declaredesign.org), measurement and nonresponse sections",,"nb04 student notebook (observational descriptive), §4–6 (Colab); lapop_brazil attribution + resample-caveat note","RDSS ch.15 + rdss lapop_brazil | measurement, nonresponse, distributions/relationships/indices, the generalization boundary | sample-survey exploration + seeded nonresponse stress-test (seed 464) | adapted",measurement of a construct; coverage; nonresponse; missingness (and why it is rarely random); distributions; relationships between variables; indices as combined measures; generalization from sample to population; the lapop_brazil resample caveat; diagnose -> redesign the observational design,"pandas (describe, groupby, missingness audit), numpy (seeded nonresponse filter, seed 464), matplotlib (distributions, an index)","lapop_brazil.csv as a sample survey (10,000-row resample, taught as a provenance lesson); seeded nonresponse filter (seed 464)","0–7 SRL-led retrieval & challenge: the SRL puts up a headline population estimate built on 40% nonresponse and asks the room what license is missing; 7–30 intensive applied AI laboratory: with Gemini as research partner, explore lapop_brazil (a distribution, one relationship, one index), then delete the least-trusting respondents and watch the estimate move, asking Gemini to draft the coverage caveat while you check it against the numbers; 30–42 peer defense + adversarial questioning: partners attack each other's generalization sentence — does the frame and response rate actually license it?; 42–50 transfer to the final project + ledger + Claim Ticket: write your project's measurement-and-coverage note, log the ledger entry, and write the Claim Ticket.","Explore lapop_brazil, build a distribution/relationship/index, then simulate nonresponse and measure how far it moves the estimate you would have reported.","📝 nb04 practice: rewrite three sample-only summaries into population claims that name their coverage limits, or explain why the crossing is not licensed.","For your own project, what is the one measurement you most worry is missing not-at-random, and how would you even notice if it were?",Your measurement-and-coverage note and the diagnosed nonresponse risk complete the M4 audit you present at this Friday's studio.,M4 — Observational descriptive design audit (final development),10 min (measurement-and-coverage note + diagnosed nonresponse risk added to the M4 audit),none (lecture day),Read the RDSS ch. 15 measurement and nonresponse sections; bring your population/frame/sample stack from the previous lecture.,Executed lapop_brazil exploration + nonresponse stress-test + your measurement-and-coverage note,"Claim Ticket #13: my project's headline description, worded to stop exactly where my frame and response rate stop.",Finish the M4 observational descriptive design audit and rehearse a 3-minute walkthrough for this Friday's studio.,Verify lapop_brazil.csv loads; pre-seed the nonresponse filter (seed 464); prepare the index example; brief the SRL on the nonresponse puzzle.,Two explorations crowd the lab → the index build ships as a provided cell and the nonresponse reveal stays live; load fails → nb04's embedded 500-row fallback carries the class.
14,2026-09-25,Fri,in-person,Week 5 — Observational descriptive research,"Studio Friday — observational descriptive audits present; the causal question opens (M4 due, M5 kicks off)",Can you walk a skeptic through your observational design and show exactly where its description must stop?,"What makes a population claim defensible out loud? Now that description is on the table, what does it take to ask a causal question honestly?",Description + Generalization -> the causal turn (studio hand-off),,,"""Here is my population, my frame, my measurement, and the exact boundary past which my description cannot go.""","""The design is standard, so it needs no audit"" — every observational description hides a selection and a coverage decision someone can question.",(no new reading — studio Friday; bring your M4 audit and a 3-minute walkthrough),,nb04 (observational descriptive) for the recap; M5 Brightspace brief (causal identification strategy or causal-language boundary),course studio protocol + M4/M5 Brightspace briefs | studio Friday | 3-minute audit walkthrough + two-line peer review slips + causal-question kickoff | newly-constructed-from-source-concept,defending an observational description aloud; the selection/coverage audit; the descriptive-to-causal boundary; milestone hand-off (M4 -> M5),none required (walkthroughs + peer review; nb04 open for reference),student's own project data plans (no shared dataset today),"0–6 research stand-up: each project states its population, its frame, and the one coverage worry it could not shake this week; 6–29 milestone kickoff from the Brightspace brief + AI-supported sprint: present the M5 deliverable and rubric (a causal identification strategy or an honest causal-language boundary), then run five 3-minute M4 walkthroughs with Gemini-assisted note-taking; 29–41 peer + AI red-team review: two-line peer reviews (best boundary / weakest boundary) plus a Gemini pass that tries to find a population the audit overclaims; 41–50 revise, update ledger + dossier, submit + Claim Ticket: patch the weakest boundary, update the dossier and ledger, submit M4, and write the Claim Ticket.","Deliver a 3-minute M4 walkthrough, collect two-line peer reviews, run a Gemini overclaim-check, and open your M5 causal question.","📝 while listening: for each walkthrough, note the strongest boundary line and the one place the description quietly overreaches.","Which classmate's coverage limit would you steal for your own project, and what does admitting it buy you?",M4 presents and submits; M5 (a causal identification strategy or a defended causal-language boundary) kicks off from its Brightspace brief.,M4 — Observational descriptive design audit (presented + submitted); M5 — Causal identification strategy or causal-language boundary (kickoff),"23-min kickoff + sprint within the studio block (M5 opens, M4 walkthroughs)",M4 presented: 3-minute walkthrough + written two-line peer reviews + Gemini overclaim-check,M4 audit complete; 3-minute walkthrough rehearsed; nb04 finished.,Delivered walkthrough + peer reviews given/received + M5 causal question drafted,"Claim Ticket #14: one coverage limit I heard today that I will adopt, and the causal question I am tempted to ask next.","Submit M4 tonight on Brightspace. For Monday, read the RDSS ch. 16 opener on observational causal designs and bring a candidate causal question.",Print two-line review slips; stage the M5 Brightspace brief; timer; consult order; confirm the Gemini overclaim-check prompt is ready.,Walkthroughs overrun → peer reviews go silent-written and the M5 kickoff moves to homework with the brief posted.
15,2026-09-28,Mon,in-person,Week 6 — Observational causal research,"Observational causal designs: counterfactuals, confounding, and the DAG that earns 'because'","Without an experiment, what would let you say an intervention caused an outcome, and what quietly forbids it?","What is the counterfactual at the heart of every causal claim? What is a confounder, drawn as a DAG? When does adjusting for observed variables identify an effect, and when does it only pretend to?",Causal reasoning — causal kind · observational pathway (Lecture 1),SRL slot 08 — rotation seat C,"Puzzle: coffee drinkers live longer in the data — draw the DAG that makes that correlation a trap, and the one that would make it a cause.","""Under the identification argument I stated and probed, the estimated effect of [treatment] on [outcome] is [value] with uncertainty.""","""We controlled for everything, so this is the causal effect"" — adjustment on observed variables is not identification when an unobserved confounder remains.","RDSS ch. 16 'Observational: causal' (book.declaredesign.org), counterfactuals, confounding, and selection-on-observables sections; the observational-causal entries in the DeclareDesign design library",optional: callingbullshit.org module on correlation and causation,"nb05 student notebook (observational causal), §1–3 (Colab); cliningsmith_etal attribution note","RDSS ch.16 + DeclareDesign library (observational causal) + rdss cliningsmith_etal | counterfactuals, treatment/outcome/estimand, confounding, selection into treatment, DAGs, selection-on-observables | potential-outcomes simulation with a hidden confounder (seed 464) + a real natural experiment for context | translated (R→Python)",counterfactual reasoning (the outcome you cannot see); treatment; outcome; estimand (the effect you are after); confounding; selection into treatment; identification; causal diagrams (DAGs); selection on observables; why 'controlling for' is not identifying,"numpy (potential-outcomes simulation with a hidden confounder, seed 464), pandas, networkx (draw the DAG)",inline potential-outcomes simulation with a planted confounder (seed 464) + cliningsmith_etal.csv (natural-experiment context),"0–9 SRL-led research puzzle: the SRL shows that coffee drinkers live longer in the data and asks the room to draw the DAG that makes the correlation a trap and the DAG that would make it a cause; 9–31 guided Gemini research-partner investigation in the notebook: with Gemini as research partner, simulate potential outcomes with a hidden confounder, watch a naive comparison miss the true estimand, then ask Gemini which variables would have to be observed to identify it and check its DAG reasoning against the simulation; 31–43 human verification + instructor formalization: the instructor formalizes counterfactuals, estimand, confounding, and selection-on-observables, and the class verifies where Gemini's identification story holds and where it breaks; 43–50 decision & defense: log the ledger entry and write the Claim Ticket.","Simulate a causal effect with a hidden confounder, show a naive comparison missing the estimand, and draw the DAG that says which variables identification would require.","📝 nb05 practice: for three observational STEM claims (fertilizer and yield, exposure and disease, a policy and an outcome), draw the confounding DAG and name the variable whose absence breaks identification.","For your own project, if you cannot run an experiment, what is the one unobserved variable most likely to be confounding your comparison, and can you get it?",Your project's causal DAG and candidate identification argument (or the honest note that none is available) begin the M5 deliverable.,M5 — Causal identification strategy or causal-language boundary,8 min (draft your causal DAG + candidate identification argument into M5),none (lecture day),Read the RDSS ch. 16 opener on observational causal designs; bring a candidate causal question.,Executed confounding simulation + your project's causal DAG + candidate identification argument,"Claim Ticket #15: the causal effect my project is after, and the one confounder that most threatens it.","Continue the M5 identification strategy. For Wednesday, read the RDSS ch. 16 sections on difference-in-differences, instrumental variables, and regression discontinuity.",Pre-seed the potential-outcomes simulation (seed 464); prepare the confounding DAG build in networkx; confirm cliningsmith_etal.csv loads; brief the SRL on the coffee puzzle.,networkx DAG plotting fails in Colab → nb05 ships the DAGs as static images with the code shown but not required; the simulation runs long → the hidden-confounder reveal is pre-computed.
16,2026-09-30,Wed,in-person,Week 6 — Observational causal research,"When nature assigns: difference-in-differences, IV, regression discontinuity, and the assumptions you cannot test","When you cannot randomize, what does each natural-experiment design exploit, and what must you take on faith?",What does difference-in-differences assume about trends? What does an instrument require? What does regression discontinuity buy near the cutoff? Which of these assumptions can data never confirm?,"Causal reasoning — causal kind · observational pathway, natural experiments (Lecture 2)",SRL slot 09 — rotation seat D,"Puzzle: a lottery decides who gets a scarce opportunity — why is that luck a research gift, and what would ruin the as-if-random logic?","""Because [natural-experiment feature] plausibly assigns [treatment] as-if at random, the estimated effect is [value]; here is the assumption a skeptic would attack.""","A difference-in-differences, IV, or regression-discontinuity label decorating a comparison whose key assumption was never stated or probed.","RDSS ch. 16 'Observational: causal' (book.declaredesign.org), difference-in-differences, instrumental-variables, and regression-discontinuity sections",,"nb05 student notebook (observational causal), §4–6 (Colab); cliningsmith_etal attribution note","RDSS ch.16 + rdss cliningsmith_etal | difference-in-differences, instrumental variables, regression discontinuity, natural experiments, untestable assumptions, causal-language boundaries | the Hajj-lottery natural experiment analyzed as a difference-in-means; DiD/IV/RDD as intuition pictures | translated (R→Python)",difference-in-differences (and the parallel-trends assumption); instrumental variables (relevance + exclusion); regression discontinuity (as-if random near the cutoff); natural experiments; untestable assumptions; the causal-language boundary — what earns 'because' and what stops at 'associated with',"pandas, numpy (difference-in-means + interval on the lottery data, seed 464), matplotlib (parallel-trends and cutoff intuition pictures, provided)",cliningsmith_etal.csv (Hajj-lottery natural experiment) analyzed as a difference-in-means; provided DiD/RDD/IV intuition figures,"0–7 SRL-led retrieval & challenge: the SRL asks why a lottery for a scarce opportunity is a research gift, and what would ruin the as-if-random logic; 7–30 intensive applied AI laboratory: with Gemini as research partner, analyze the real lottery natural experiment (balance check, effect estimate, interval), then for each of difference-in-differences, IV, and regression discontinuity ask Gemini to state the one untestable assumption and check whether it holds here; 30–42 peer defense + adversarial questioning: partners attack each other's identification argument at its weakest assumption; 42–50 transfer to the final project + ledger + Claim Ticket: write your project's identification paragraph or its honest causal-language boundary, log the ledger, and write the Claim Ticket.","Analyze a real lottery natural experiment end-to-end, then match difference-in-differences, IV, and regression discontinuity to the untestable assumption each would require.","📝 nb05 practice: for each of difference-in-differences, IV, and regression discontinuity, write the one sentence a skeptic would attack first, and how you would probe it.","For your own project, is there any natural experiment hiding in how your treatment gets assigned — a lottery, a cutoff, a rule change — or must your claim stop at association?",Today you write your project's identification paragraph or its honest causal-language boundary — the core of the M5 deliverable due at this Friday's async studio.,M5 — Causal identification strategy or causal-language boundary (final development),10 min (identification paragraph or causal-language boundary drafted into M5),none (lecture day),"Read the RDSS ch. 16 difference-in-differences, IV, and regression-discontinuity sections; bring your causal DAG from the previous lecture.",Analyzed lottery natural experiment + your identification paragraph (or honest causal-language boundary),"Claim Ticket #16: my project's causal status in one sentence — identified by ___, or honestly stopping at association.","This Friday runs asynchronously online: complete nb05, run the required GenAI Studio 'Causal Identification Skeptic' review, and submit M5 by the posted time. Budget about 50 minutes.",Verify cliningsmith_etal.csv loads and the effect reproduces; check the DiD/RDD intuition figures render; brief the SRL on the lottery puzzle; confirm the async module and discussion board are staged.,Intuition pictures crowd the lab → the DiD/RDD/IV block compresses to the three figures and nb05 carries the depth; content overruns → the identification paragraph moves into the async studio.
17,2026-10-02,Fri,async-online,Week 6 — Observational causal research,"ASYNC — self-paced causal studio: the identification skeptic reviews your design (M5 submits, M6 brief posts)",Can your causal claim survive a skeptic you cannot argue back to in real time?,"Does your identification argument state its untestable assumption plainly? Where would a hostile reviewer break it? If no identification is available, is your causal-language boundary honest and explicit?",Causal reasoning — causal kind · observational pathway (async claim defense),,,"""My design identifies the effect by [argument]; the assumption it rests on is [X]; a skeptic's strongest objection is [Y], and here is my answer.""","A causal claim submitted without naming its untestable assumption, or a boundary that quietly keeps causal language it has not earned.","RDSS ch. 16 'Observational: causal' (book.declaredesign.org), assumption-probing sections (read before Monday)",optional: one callingbullshit.org case of your choice from the module linked in nb05,nb05 — fully self-contained async module (Colab); GenAI Studio 'Causal Identification Skeptic' role; M6 Brightspace brief (posted today),RDSS ch.16 + course async-studio protocol + GenAI Studio reviewer bench | self-contained causal claim defense | recorded stand-up + async red-team board exchange + required skeptic role review | newly-constructed-from-source-concept,stating an untestable assumption plainly; adversarial review of an identification argument; the required GenAI Studio 'Causal Identification Skeptic' pass; honest causal-language boundaries; asynchronous research defense,pandas (one small recompute of your own estimate); no live session,student's own project data plans + the nb05 lottery example for reference,"ASYNC (~50 min self-paced, no live meeting): 0–8 record and post a 90-second research stand-up stating your causal question and candidate identification argument to the discussion board; 8–28 sprint: complete nb05 and assemble your M5 — the identification paragraph (or honest causal-language boundary), its untestable assumption, and one recompute of your own estimate; 28–40 asynchronous peer red-team exchange: post your identification argument and reply to one classmate's with the single assumption you would attack, then run the REQUIRED GenAI Studio 'Causal Identification Skeptic' review and patch the weakest point it finds; 40–50 submission: finalize M5, update the dossier and AI Research Ledger (including the skeptic-review pass), and submit with your Claim Ticket.","Complete the self-contained causal module: recompute your own estimate, run the required GenAI Studio 'Causal Identification Skeptic' review, exchange async red-team notes, and submit M5.","📝 nb05 async practice: classify three published causal headlines by whether they name their identifying assumption, and rewrite one to stop at what it earns.","(async board post) Post your identification argument and its untestable assumption; reply to one classmate with the single assumption you would attack first, and why.",M5 submits and the causal branch of your design is locked or honestly bounded; the M6 brief opens the experimental-measurement question.,M5 — Causal identification strategy or causal-language boundary (submitted async); M6 — Experimental measurement or data-acquisition protocol (brief posted),module includes a 20-min M5 assembly block + the required GenAI Studio skeptic review,async board: 90-second recorded stand-up + one red-team reply + required GenAI Studio 'Causal Identification Skeptic' review logged in the ledger,nb05 lectures complete; identification paragraph (or causal-language boundary) drafted; GenAI Studio account access confirmed.,Completed nb05 async module: recompute cell + skeptic-review log + red-team exchange + submitted M5 + board stand-up,"(embedded in the module) Claim Ticket #17: the assumption the skeptic attacked hardest, and how I answered or conceded it.","Submit M5 and the nb05 module by the posted time. For Monday, read the RDSS ch. 17 opener on experimental descriptive designs; the M6 brief is on Brightspace.",Final-check nb05 runs unattended end-to-end; confirm the GenAI Studio 'Causal Identification Skeptic' role is live with its instructions in the module; post the M6 brief; seed and monitor the discussion board while traveling.,A student is stuck alone → nb05 embeds hints behind expandable cells and an office-hours booking link; GenAI Studio unavailable → a provided Gemini fallback skeptic prompt stands in and the required review is logged when the service returns; the board is monitored remotely through the day.
