meeting,date,day,modality,unit,title,driving_question,secondary_questions,inquiry,srl_slot,srl_focus,claim_permitted,claim_not_permitted,rdss_reading,cb_reading,other_material,provenance,concepts,python_r_dependency,dataset_simulation,minute_dynamic,hands_on_activity,practice,discussion_prompt,project_connection,milestone_developed,milestone_work_time,milestone_presentation_review,student_prep,student_artifact,exit_ticket,homework_next_milestone,instructor_prep,risks_contingency
23,2026-10-19,Mon,in-person,Week 9 — Experimental causal research,"Experimental causal research I: potential outcomes, random assignment, and what an experiment actually estimates","If you could run the world twice — once with the treatment, once without — what would you compare, and why does randomizing let you fake that comparison?","What are the potential outcomes Y(1) and Y(0), and why can you never see both for one unit? What exactly does random assignment buy you? What is an average treatment effect, and how does randomization inference put an interval around it? When is a study too small to detect the effect it is looking for?",CAUSAL — causal kind (experimental design),SRL slot 13 — rotation seat C,"Puzzle: a get-out-the-vote canvass reached some households and not others, and the canvassed ones voted more — but what has to be true about WHO got canvassed before that gap is the effect of canvassing?","""Because assignment was randomized and I checked balance, the difference in means estimates the average treatment effect, reported with a randomization-inference interval.""","""The treated group did better, so the treatment worked"" — with no check that assignment, not the kind of people in each group, produced the gap.",RDSS ch. 18 'Experimental: causal' (book.declaredesign.org); declaration_18.1 (two-arm trial),,"nb08 student notebook (experimental causal research), §1–3 (Colab); Gemini in Colab as the in-class research partner","RDSS ch.18 + declaration_18.1.R + rdss foos_etal | experimental causal design | two-arm trial, difference-in-means, and randomization inference translated to the course's Python helpers | translated (R→Python)",potential outcomes Y(1)/Y(0) and the fundamental problem of causal inference; random assignment as the counterfactual-maker; treatment and control conditions; the average treatment effect (ATE); randomization inference; statistical power and the minimum detectable effect,"numpy/pandas (difference-in-means + randomization-inference interval on foos_etal); matplotlib (the sharp-null reference distribution, provided)",foos_etal.csv (real get-out-the-vote field experiment) + inline seeded simulation of a two-arm trial for the power demonstration,"0–9 SRL-led research puzzle: the lead stands the canvassing gap and presses the class — is this the effect of canvassing, or the effect of who happens to answer the door?; 9–31 guided Gemini research-partner investigation in the notebook: nb08 defines Y(1)/Y(0) on a toy world, then analyzes the real foos_etal experiment (balance check, difference in means, randomization-inference interval) with Gemini proposing each step and the class inspecting its output; 31–43 human verification + instructor formalization: recompute the interval against the helper, name the ATE the number estimates, and run the power / minimum-detectable-effect cell to see when a true effect would go undetected; 43–50 decision & defense: ledger entry (what Gemini proposed, how it was verified) + Claim Ticket.","Analyze a real randomized field experiment end to end — balance, ATE, randomization-inference interval — and read a power curve to find the smallest effect the design could have caught.","📝 nb08 practice: for three described studies, write Y(1) and Y(0) for one unit and mark which is observed; then say whether each study is powered to detect a small, medium, or only a large effect.","You get a p-value below 0.05 from twelve participants. Why should a randomization-inference interval, not the p-value alone, decide whether you believe the effect?",Every project that declared an experimental (or experiment-like) pathway begins its M8 minimum viable analysis here; projects on other pathways run the branch their declaration named.,M8 — Minimum viable analysis,8 min (start your branch's first computed estimate),none (lecture day),RDSS ch. 18 read; your declared analysis protocol (M7) at hand so you know which branch your M8 runs.,Analyzed foos_etal experiment + first computed estimate started on your own project's branch,"Claim Ticket #23: ""The number my M8 will report is an average treatment effect only because assignment was random — and here is the balance check that earns me the word.""","Finish nb08's potential-outcomes and power practice cells; Wednesday we take on what breaks a clean experiment — attrition, noncompliance, spillovers — and keep building M8.",Verify foos_etal loads and the ATE + randomization-inference interval reproduce; pre-run the power cell so the curve renders fast; brief the SRL on the canvassing puzzle.,"Randomization inference feels abstract → the toy two-unit world grounds it first, and the helper does the resampling; students choose the outcome column and read the interval, they do not code the loop."
24,2026-10-21,Wed,in-person,Week 9 — Experimental causal research,"Experimental causal research II: blocking, clusters, factorials, and the things that break a clean experiment",Your randomization was perfect on paper — then a third of participants dropped out and neighbors talked to each other. What did you actually estimate?,"How do blocking and cluster randomization change what you can learn? What does a factorial design test at once? How do attrition, noncompliance, spillovers, and interference each bias or reinterpret the effect? When many outcomes are tested, why does at least one 'work' by chance — and what is a heterogeneous effect?","CAUSAL — causal kind (experimental design, real-world threats)",SRL slot 14 — rotation seat D,"Puzzle: the treatment 'worked' but a third of participants dropped out before the outcome was measured — what did we actually estimate, and for whom?","""After accounting for [attrition / noncompliance / clustering], my estimate is the effect for [this well-defined group], with its uncertainty and its limits stated.""","Reporting a clean average treatment effect while attrition, noncompliance, or spillovers silently changed which units and which quantity the number describes.","RDSS ch. 18 'Experimental: causal' (continued — blocking, clustering, and the complications sections; book.declaredesign.org)",,"nb08 student notebook (experimental causal research), §4–6 (Colab); Gemini in Colab as the applied-lab partner",RDSS ch.18 (blocking/cluster/factorial + attrition/noncompliance/spillover sections) + foos_etal | experimental causal complications | design variants and threat diagnostics translated to seeded Python simulations | translated (R→Python),blocking; cluster randomization; factorial designs; attrition; noncompliance (and the local effect it leaves you); spillovers and interference; multiple-outcome testing; heterogeneous treatment effects; the ethical and practical limits of experimenting on people,numpy/pandas (seeded simulations of attrition and spillover on the two-arm world; subgroup estimates for heterogeneity),"foos_etal.csv (subgroup / heterogeneity reading) + inline seeded simulations that inject attrition, noncompliance, and spillover to show each threat's footprint","0–7 SRL-led retrieval & challenge: the lead replays yesterday's clean estimate, then breaks it — a third of units vanish before measurement — and challenges the class to say what the number now means; 7–30 intensive applied AI laboratory: in nb08, use Gemini to simulate blocking and clustering (does the interval tighten or widen?), run a factorial cell, then inject attrition, noncompliance, and spillover and watch the estimate move — inspecting and correcting every Gemini step; 30–42 peer defense + adversarial questioning: in pairs, each student defends 'my M8 estimate survives these threats because…' while the partner plays the spillover-and-attrition skeptic; 42–50 transfer to your own project + ledger + Claim Ticket.","Simulate blocking, clustering, and a factorial design, then inject attrition, noncompliance, and spillover into the same experiment and report how each one changes the effect you can honestly claim.","📝 nb08 practice: match four broken experiments to the threat that broke them (attrition / noncompliance / spillover / multiple-outcome fishing); for one, name the group your surviving estimate actually describes.","A study reports the one outcome out of twenty that reached significance. What did the other nineteen tests do to that claim, and how would an honest report show them?",M8 advances: each project names the single threat nearest its own design and states how the minimum viable analysis handles or bounds it.,M8 — Minimum viable analysis,16 min (run your branch's estimate + name and bound its nearest threat),peer defense rounds (adversarial pairs; the 60-second pitches come at this Friday's M8-due studio),RDSS ch. 18 complications sections read; Monday's foos_etal analysis at hand; M8 branch running.,Threat-injected simulations + own M8 estimate with its nearest threat named and bounded,"Claim Ticket #24: ""My M8's biggest threat is [attrition / noncompliance / spillover / multiplicity], and here is the group and quantity my estimate honestly describes once I account for it.""","Finish your minimum viable analysis; it is due at this Friday's studio, where you pitch it in 60 seconds and kick off the poster draft (M9).",Verify the attrition/noncompliance/spillover simulation cells run in seconds; prep the adversarial-pair prompt cards; brief the SRL on the drop-out puzzle.,"The complication list overwhelms → the lab commits to attrition + spillover as the two everyone simulates; blocking, clustering, and factorial run as read-and-inspect demos, with nb08 carrying the depth."
25,2026-10-23,Fri,in-person,Week 9 — Experimental causal research,"Studio Friday — minimum viable analysis due: first real evidence, and the poster draft begins","You have your first computed estimate on your own question. Can you say what it shows, what it cannot, and pitch it in 60 seconds?",What makes a minimum viable analysis 'viable' rather than final? What does the M9 poster draft + research audit ask of your compass position? Where does your poster's headline claim start?,all positions (first computed evidence → communication),,,"""Here is my first real estimate, the check that makes me trust it, and the boundary my compass position puts on what it means.""",A pitch of a result with no verification and no stated limit — a number is not yet evidence until you have checked it and bounded it.,(no new reading — studio Friday; bring your executed minimum viable analysis),,nb08 student notebook (experimental causal) for the recap; M9 Brightspace brief (poster draft 1 + research audit); project/poster/storyboard_protocol.md (headline-claim preview); 60-second pitch timer,week's nb08 material + M9 Brightspace brief + project/poster/storyboard_protocol.md | studio Friday | 60-second evidence pitch + poster-draft kickoff | fresh,the minimum viable analysis as first honest evidence; verifying before believing your own output; the poster draft as the week ahead; the research audit that will attack it,none required (analysis helpers stay open for consults),each student's own project data (M8 estimate),"0–6 research stand-up: each student's one-line status on their minimum viable analysis (what ran, what is shaky); 6–29 milestone kickoff + AI-supported sprint: present the M9 brief on Brightspace — poster draft 1 plus a research audit — then a supported sprint to finalize the M8 estimate and verify it, Gemini on call for the stubborn cell; 29–41 peer + AI red-team review: 60-second evidence pitches (my estimate, my check, my boundary) on a hard timer, peers and a Gemini skeptic each naming the one thing they do not yet believe; 41–50 revise, log the ledger, submit M8 tonight + Claim Ticket.","Deliver your 60-second evidence pitch with its verification and boundary, take the red-team's one hit, and submit your minimum viable analysis.","📝 during consults: write the poster headline claim your M8 evidence could support today — ≤ 15 words, inside your compass position's boundary.",Which classmate's estimate did you most want to believe but could not yet — and what one check would have won you over?,M8 submits tonight; every project leaves with a headline-claim seed and a locked plan for the M9 poster draft + research audit.,M8 — Minimum viable analysis (due tonight) → M9 — Poster draft 1 and research audit (kickoff),30 min studio block,M8 presented: 60-second evidence pitches with peer + AI red-team hits,Minimum viable analysis executed (any state of polish); pitch rehearsed once; verification note ready.,Delivered pitch + red-team hit logged + submitted M8,"Claim Ticket #25: ""My poster's headline claim starts as [≤ 15 words], and my M8 evidence backs exactly that much — no more.""",Submit M8 tonight on Brightspace. Monday begins the attack on your own analysis — robustness and sensitivity before the poster; bring your estimate and your worst worry about it.,Pitch timer; consult order; M9 brief staged on Brightspace; keep the analysis helpers loadable; storyboard preview ready.,"An analysis is not done → the pitch still happens on what runs (the submission deadline is tonight, not the pitch); overflow verification moves to office hours."
26,2026-10-26,Mon,in-person,Week 10 — Share the research and attack the analysis,"Attack the analysis I: robustness, sensitivity, and the line between them and p-hacking","If your result only holds one way of slicing the data, is it a finding — or an accident you went looking for?","What is a robustness check versus a sensitivity check? What do placebo, falsification, and negative tests each try to break? How do alternative samples, measurements, specifications, and metrics stress a claim? What separates honest robustness from specification searching?",all positions (attacking your own analysis),SRL slot 15 — rotation seat E,"Puzzle: our headline result is significant under one specification and vanishes under another — is the result fragile, or did we just find the one specification that worked?","""My claim survives these pre-listed robustness and placebo checks; where it moves, I report by how much and why.""","Reporting the one specification that 'worked' after quietly trying many, without disclosing the search — the definition of specification searching.",(no new RDSS chapter — attack-the-analysis week; the readings are the robustness/red-team protocols and your own declared analysis protocol),optional: callingbullshit.org — a 'the result vanished under reanalysis' case,"nb09 student notebook (attack the analysis), §1–3 (Colab); Gemini in Colab as the robustness-lab partner; project/poster/redteam_review_protocol.md (the four-audit vocabulary, previewed)",fresh (robustness/sensitivity protocol) + course honest-analysis discipline | attack-the-analysis unit | placebo/falsification/negative tests + alternative-specification grid built as seeded Python cells | fresh,"robustness vs sensitivity; placebo tests; falsification tests; negative tests; alternative samples, measurements, specifications, and metrics; outlier and influence analysis; robustness vs specification searching (the pre-listed-checks discipline)","numpy/pandas (rerun the estimate across a pre-listed robustness grid; leave-one-out influence cells); matplotlib (the specification curve, provided)",each student's own M8 estimate rerun under alternative specifications + a shared demonstration dataset with one influential outlier,"0–9 SRL-led research puzzle: the lead shows one result that lives or dies by a single specification choice and asks the class to rule fragile vs cherry-picked; 9–31 guided Gemini research-partner investigation in the notebook: nb09 pre-lists the checks first, then reruns the estimate across alternative samples, measurements, specifications, and metrics, adds placebo and leave-one-out influence cells, and reads the specification curve — Gemini proposing checks, the class inspecting each; 31–43 human verification + instructor formalization: separate the checks that were pre-committed from the ones that would be fishing, and name the honest headline the surviving evidence supports; 43–50 decision & defense: ledger entry + Claim Ticket.","Pre-list your robustness checks, then rerun your own estimate across alternative specifications, run placebo and influence tests, and report where the claim holds and where it moves.","📝 nb09 practice: label six analyses as robustness check or specification search; for the shared outlier dataset, find the one point whose removal flips the result.",You ran ten specifications and report the one that is significant. Write the sentence that turns that from p-hacking into honest robustness — what would you have had to do first?,M9 poster draft + research audit begins: each project pre-lists its robustness checks and runs the first ones against its own M8 estimate.,M9 — Poster draft 1 and research audit,10 min (pre-list your checks + run the first robustness rerun),none (lecture day),M8 submitted; the estimate you most want to stress-test at hand.,Pre-listed robustness checks + first alternative-specification rerun of own estimate,"Claim Ticket #26: ""My result holds or moves under my pre-listed checks; the one that stresses it most is [check], and here is what it did.""",Run the rest of your pre-listed checks in nb09; Wednesday you turn AI reviewers loose on your own analysis and compare what they catch.,Verify the robustness-grid and influence cells run fast; build the shared one-outlier dataset; brief the SRL on the fragile-specification puzzle.,"The specification grid balloons → students commit to three pre-listed checks maximum for class, the rest as homework; the pre-listing rule is the point, not the count."
27,2026-10-28,Wed,in-person,Week 10 — Share the research and attack the analysis,"Attack the analysis II: human versus AI reviewers, and adversarial review of your own work","When a human reviewer, one AI, and a panel of AIs read the same analysis, who catches what — and would you have caught it yourself?",How does AI reviewer feedback differ from a peer's? What does a multi-model comparison reveal that a single model hides? How do you run an adversarial-reviewer role against your own analysis without letting it write your conclusions? Where do AI reviewers confidently mislead?,all positions (adversarial review),SRL slot 16 — rotation seat A,"Puzzle: three AI reviewers named three different 'most serious flaws' in our analysis — which one is real, and how would we tell without just trusting the most confident one?","""I ran my analysis past a human reviewer and a multi-model AI panel, verified their hits against the data, and folded the real ones into my audit — with a note on what they got wrong.""","Accepting an AI reviewer's verdict as authority (or blaming it for a miss) — the reviewer proposes, you verify; a flaw is real only if the data show it.",(no new RDSS chapter — attack-the-analysis week; the readings are the red-team protocol and your AI Research Ledger),,"nb09 student notebook (attack the analysis), §4–5 (Colab); Purdue GenAI Studio — the multi-model comparison + an adversarial-reviewer role (today's designated GenAI Studio touchpoint); AI Research Ledger template",fresh + GenAI Studio reviewer bench | attack-the-analysis unit | multi-model reviewer comparison + adversarial-reviewer role protocol | fresh,"human vs AI reviewer feedback; multi-model comparison (agreement, disagreement, and confident error); the adversarial-reviewer role; verifying AI-flagged issues against the data; documenting AI review in the ledger",none new (GenAI Studio runs alongside; every flagged issue is re-checked in the student's own notebook),"each student's own analysis + its written summary, submitted to the reviewers","0–7 SRL-led retrieval & challenge: the lead recaps yesterday's honest-robustness line and challenges the class — can an AI reviewer tell robustness from p-hacking?; 7–30 intensive applied AI laboratory: in GenAI Studio, run your analysis summary through a single reviewer, then a multi-model panel, then an adversarial-reviewer role instructed to find its worst flaw — logging every hit and disagreement in the ledger; 30–42 peer defense + adversarial questioning: pair up, trade the AI panels' verdicts, and defend which flags are real (checked against your data) versus confident nonsense; 42–50 transfer to your project + ledger + Claim Ticket.","Run your own analysis through a human reviewer and a GenAI Studio multi-model panel plus an adversarial-reviewer role, then verify each flagged issue against your data and record which were real.","📝 nb09 practice: given three AI reviewers' conflicting 'top flaws' on a sample analysis, design the one data check that would confirm or kill each.",An AI reviewer flagged a flaw your human reviewer missed — and invented one that is not there. What does that pattern tell you about how to use it?,"M9 research audit takes shape: each project's audit now carries verified human + multi-model AI review, with the real hits triaged and the false ones noted.",M9 — Poster draft 1 and research audit,"16 min (run the multi-model + adversarial review on your own analysis, log it)",peer defense rounds (real-vs-confident-nonsense triage; the studio pitches come at this Friday's M9-due studio),Robustness checks from Monday run; a one-paragraph written summary of your analysis ready to hand a reviewer.,"Human + multi-model AI review logged in the ledger, each hit verified real or refuted","Claim Ticket #27: ""The realest flaw any reviewer found in my analysis is [flaw]; I confirmed it with [check]; the most confident wrong flag was [x].""","Fold the verified hits into your poster draft and research audit; both are due at this Friday's studio, where you present the draft and log the required GenAI Studio Poster Critic and Robustness reviews.",Confirm GenAI Studio access and that the adversarial-reviewer and multi-model roles are live; verify the RCAC endpoint; prep the conflicting-reviewers practice case; brief the SRL.,"GenAI Studio access fails → the multi-model comparison runs on provided saved transcripts of three models reviewing a sample analysis; the lesson (compare, then verify) survives without live access."
