meeting,date,day,modality,unit,title,driving_question,secondary_questions,approach,claim_permitted,claim_not_permitted,rdss_reading,cb_reading,other_material,provenance,concepts,python_r_dependency,dataset_simulation,minute_dynamic,hands_on_activity,practice,discussion_prompt,project_connection,milestone_developed,milestone_work_time,milestone_presentation_review,student_prep,student_artifact,exit_ticket,homework_next_milestone,instructor_prep,risks_contingency
28,2026-10-30,Fri,in-person,"Phase 4 — Pilot, diagnosis, redesign",Causal reasoning deep dive II: causal claims without experiments — and the M09 pilot walkthroughs,"When you cannot randomize, what earns you the word 'because'?","What leverage do DiD, RDD, and IV each exploit (intuition only)? What assumptions does each buy its identification with? How do you present a pilot honestly?",CAUSAL (deep dive),"""Under [parallel trends / threshold locality / instrument validity — stated and probed], the estimate carries a causal reading.""",Design-mimicry: DiD/RDD/IV vocabulary decorating a comparison whose assumptions were never argued.,RDSS ch. 16 'Observational: causal' (book.declaredesign.org) — DiD/RDD/IV intuition sections,,nb13 §3–4 (Colab); cliningsmith_etal.csv (natural-experiment flavor),"RDSS ch.16 + rdss cliningsmith_etal | observational causal designs | DiD/RDD/IV intuition, no estimation machinery | adapted","difference-in-differences, regression discontinuity, instrumental variables — as identification ARGUMENTS; assumption probing","pandas/matplotlib (picture-first DiD and RDD illustrations, provided)","cliningsmith_etal.csv + two seeded illustrative simulations (parallel-trends world, threshold world)","0–5 settle + walkthrough order; 5–15 mini-lesson: three ways nature randomizes for you, one picture each (DiD's parallel lines, RDD's cliff, IV's nudge); 15–20 quick check: match 3 scenarios to their design; 20–42 M09 PILOT WALKTHROUGHS: five ~4-minute walkthroughs (what I ran, what came out, what surprised me), listeners log one verification question each; 42–48 revision notes + submission checklist; 48–50 exit ticket.",Match natural-experiment scenarios to their identification argument; probe one assumption per design.,"📝 nb13 practice: for each of DiD/RDD/IV, write the one sentence a skeptic would attack first.",On a classmate's pilot: what is the single verification step you most want them to run before believing their own output?,"M09 pilots presented and submitted — every project now has real preliminary evidence, honestly bounded.",M09 — Pilot Analysis (presented + submitted TONIGHT),22 min (walkthroughs) + 6 min (revision + checklist),M09 presented: 4-minute pilot walkthroughs + logged verification questions,Pilot analysis executed (any state of polish); walkthrough rehearsed.,Delivered walkthrough + verification-question log + submitted M09,"Claim Ticket #28: the verification question a classmate asked me, and how I will answer it before the poster.",Submit M09 tonight 11:59 PM. Monday: POSTER PHASE — bring your best figure and your headline claim.,Timer; walkthrough rubric; check the three intuition pictures render cleanly; verify cliningsmith_etal loads.,A pilot collapsed during the week → its walkthrough presents the failure + diagnosis (explicitly graded as legitimate); redesign happens in office hours.
29,2026-11-02,Mon,in-person,Phase 5 — Poster construction & submission,"Poster I: storyboard — one claim, one hierarchy of evidence","If a stranger reads your poster for 90 seconds, what ONE defensible claim must survive?",What is an evidence hierarchy on a poster? What earns the top-center slot? How does uncertainty live on a poster without killing it?,all (communication),"The poster's headline claim, worded to match its approach's boundary — description as description, association as association.",A headline that outruns the pilot's evidence (the 90-second reader will never see your caveats footnote).,(fresh unit; RDSS figure style referenced for honest graphics),,nb14 §1–2 (Colab); URC poster specs; storyboard template,brief §12 P5 + fresh storyboard method + Purdue URC specs | poster unit | storyboard grid | fresh,storyboarding; claim hierarchy; the 90-second read path; poster real estate economics; uncertainty placement,"none required (figure polish optional, matplotlib)",each student's own pilot outputs,"0–5 poster-phase kickoff: the Nov 6 deadline is REAL (production, not buffer); 5–12 mini-lesson: the 90-second read path traced on two example posters (one strong, one lost); 12–30 studio: fill the storyboard grid — headline claim, 3 evidence blocks ranked, uncertainty line, read path arrows (M10); 30–42 STORYBOARD PITCHES: 90 seconds each — walk us down your read path; listeners mark where they got lost; 42–48 revise the grid from the lost-points; 48–50 exit ticket + M10 submission tonight.",Fill the storyboard grid for your own poster and walk a listener down its 90-second read path.,📝 nb14 practice: rank your pilot's 5 outputs by evidence value for the headline claim; cut the bottom two.,What did the strong example poster REFUSE to include — and why did that refusal make it stronger?,M10 storyboard submitted tonight; the draft build starts from it Wednesday.,M10 — Poster Storyboard (presented + submitted TODAY),18 min (grid studio) + 6 min (revision),M10 presented: 90-second storyboard pitches with lost-point marking,M09 submitted; best figure + headline claim in hand.,Completed storyboard grid + pitch + revision marks,"Claim Ticket #29: my headline claim, ≤15 words, inside my approach's boundary.",Submit M10 tonight 11:59 PM; build the full draft poster for Wednesday's red-team (any tool: PowerPoint/Canva/Quarto).,Two example posters chosen; storyboard grids printed; URC spec sheet distributed.,Pilot results too thin for a poster → the storyboard pivots to 'design + preliminary evidence' framing (explicitly legitimate for URC undergraduate posters).
30,2026-11-04,Wed,in-person,Phase 5 — Poster construction & submission,Poster II: draft + red-team — attack your own poster before strangers do,"Where does your draft overclaim, underexplain, or lose the reader — and who will find it first?","What does a red-team review look for (claim boundary, figure honesty, read path, uncertainty)? How do you take a hit and revise?",all (communication),"""A hostile reader walked my poster and the headline survived — here are the three hits and my three fixes.""","Shipping a draft no adversarial eye has touched (peer-review is the course's quality gate, not a courtesy).",(fresh unit),optional: the honest-viz checklist from M14 rides again,nb14 §3 red-team protocol (Colab); draft posters on screens,fresh (red-team protocol) + M14 honest-viz checklist | poster unit | adversarial review protocol | fresh,red-team review; claim-boundary audit; figure-honesty audit; read-path audit; revision triage,none,each student's own draft poster,"0–5 red-team norms: hard on the poster, warm on the person; roles assigned (each student red-teams two posters); 5–10 protocol walkthrough: the four audits with the scoring slip; 10–34 RED-TEAM ROUNDS: two 12-minute rounds — reviewer walks the poster with the audit slip while the author listens silently, then 2 minutes of author questions; 34–46 revision triage: authors rank their hits, fix the top one NOW, plan the rest; 46–50 exit ticket + M11 submission tonight (draft + received reviews + triage plan).",Red-team two classmates' posters with the four-audit slip; triage and begin fixing your own hits.,📝 nb14 practice: the four audits applied to a sample poster with 6 planted flaws — find at least 4.,Which audit found your poster's worst flaw — and why didn't YOU find it first?,M11 (draft + red-team record) submits tonight; only production polish remains before Friday.,M11 — Poster Draft + Red-Team Review (submitted TODAY),24 min (red-team rounds) + 12 min (triage + first fix),M11 review: structured red-team with written audit slips (this IS the presentation/review),Full draft poster ready on screen (Monday's homework).,Two completed audit slips given + own triage plan + first fix applied,"Claim Ticket #30: the hit I'm fixing first, and what the fixed version says instead.",Apply the full triage plan; FINAL poster due Friday in class (production day) — submission Nov 6 is the real deadline.,"Print audit slips; assign the red-team rotation (5 students → each reviews 2, is reviewed by 2); sample flawed poster ready.",A draft doesn't exist by class → that student red-teams others (obligation stands) and enters Friday's production day with the storyboard + instructor triage instead.
31,2026-11-06,Fri,in-person,Phase 5 — Poster construction & submission,Poster III: final production and SUBMISSION — the deadline is today,Is every claim on this poster one you can defend to a stranger on Nov 17?,Does the final pass the four audits? Are figures reproducible from your notebook? Is the file print-ready to URC spec?,all (communication),"""Submitted: every number on this poster traces to a cell in my notebook, and every claim sits inside my approach's boundary.""","""I'll fix it after submission."" (There is no after — Nov 17 is a live audience, not a draft reader.)",(fresh unit),,nb14 §4 final checklist (Colab); URC submission portal/instructions,fresh + Purdue URC specs | poster unit | final production checklist | fresh,production checklist; number-to-notebook traceability; print specs; submission hygiene,none (figure re-exports as needed),each student's own final poster,"0–5 deadline briefing + checklist distributed; 5–35 PRODUCTION SPRINT: silent studio, instructor circulates on a fixed rotation (5 × ~5 min consults) running the final checklist on each poster; 35–45 traceability spot-check: for one number on your poster, show the notebook cell that produced it (pairs verify each other); 45–50 SUBMIT (Brightspace + URC channel as instructed) + exit ticket.","Final production sprint: run the checklist, verify one number's notebook traceability under a partner's eyes, submit.",📝 (embedded in checklist) verify: fonts ≥ minimum size at print scale; every figure has its uncertainty or its caveat.,"(brief, during consults) Which checklist line almost caught you?",M12 FINAL POSTER submitted — the URC artifact is locked; everything after this is delivery and depth.,"M12 — Final Poster (SUBMITTED TODAY, Nov 6)",45 min (production + verification + submission),instructor final-checklist consults + pair traceability check,Triage plan fully applied; print-ready file staged.,Submitted final poster + signed checklist + traceability verification,"Claim Ticket #31: one claim I softened before submission, and why the softer version is stronger.",Rest this weekend. Monday: from poster to PERFORMANCE — the 1-minute and 3-minute pitches.,Confirm submission mechanics (portal/print shop); consult rotation timer; backup printing plan.,Printing/portal failure → PDF submission to Brightspace timestamps the deadline; physical printing resolves next week (before Nov 17).
32,2026-11-09,Mon,in-person,Phase 6 — Conference preparation,Delivery I: the 1-minute and 3-minute pitch architectures,A visitor stops at your poster. What do your first 60 seconds do?,How do the 1-min and 3-min versions differ in job (hook vs walk)? Where does the claim boundary live in spoken form? What does a confident 'we don't know yet' sound like?,all (communication),"Spoken claims that match the poster's written boundary — the pitch may compress evidence, never inflate it.",The excited-mouth upgrade: saying 'causes' at the poster after writing 'is associated with' on it.,(fresh unit),,nb15 §1–2 (Colab); pitch architecture templates,brief §12 P6 + fresh pitch architectures | conference unit | 1-min hook / 3-min walk scripts | fresh,"pitch architecture (hook, claim, evidence, boundary, invitation); compression without inflation; spoken uncertainty",none,each student's own poster,"0–5 poster-phase debrief + what Nov 17 actually looks like (logistics); 5–13 mini-lesson: the two architectures, demonstrated live by the instructor on a past poster (once well, once inflated — spot the upgrade); 13–28 drafting studio: script your 1-minute hook using the template, mark the boundary sentence (M13); 28–42 FIRST DELIVERY ROUND: everyone delivers the 1-minute to a partner twice (swap roles), partner flags any spoken upgrade; 42–48 revise scripts; 48–50 exit ticket.",Script and twice-deliver your 1-minute pitch; catch your partner's spoken claim-upgrades.,📝 nb15 practice: compress your 3 evidence blocks into one spoken sentence each — no inflation allowed.,Where in the instructor's inflated demo did the claim outrun the poster — what exact word did it?,M13 presentation plan begins: the 1-minute script is its first component.,M13 — Presentation Plan (1-min + 3-min),15 min (scripting) + 14 min (delivery rounds),partner delivery rounds with upgrade-flagging,Final poster content internalized; comfortable saying your headline claim aloud.,1-minute script with marked boundary sentence + delivery feedback,"Claim Ticket #32: my boundary sentence, exactly as I will SAY it.","Draft the 3-minute walk script; M13 (both scripts + poster-walk map) due Wed Nov 11, 11:59 PM.",Rehearse the well/inflated demo pair; print architecture templates; confirm URC-day logistics to brief.,Stage fright surfaces → normalize with the two-attempt structure (everyone's first attempt is officially a draft) and offer office-hours solo rehearsal.
33,2026-11-11,Wed,in-person,Phase 6 — Conference preparation,"Delivery II: uncertainty and limitations, spoken like a scientist",Can you state what your study CANNOT show — and make it sound like strength?,Why do limitations spoken first-person build credibility? What is the uncertainty-limitations-next-step (ULN) move? How do you avoid the apology spiral?,all (communication),"""This is an association in a convenience frame; it cannot establish X; the design that could is Y"" — limitation as expertise.","Either failure mode: hiding limitations, or drowning in them (""this is probably all wrong"") — both misstate the evidence.",(fresh unit; RDSS ch. 10 diagnosands vocabulary echoes in spoken form),,nb15 §3 (Colab); ULN move template; M13 due tonight,brief §12 P6 + fresh ULN protocol | conference unit | spoken-limitations discipline | fresh,the ULN move (uncertainty → limitation → next step); credibility mechanics; the apology spiral and its antidote,none,each student's own findings,"0–5 1-minute pitch pulse (one volunteer, warm notes); 5–12 mini-lesson: the ULN move, demonstrated on three findings including a null; 12–24 writing studio: draft YOUR ULN paragraph (M14 core) — the honest limitation, said with a straight spine; 24–40 ULN ROUNDS: deliver your ULN to two successive partners; partners score on the strength-not-apology scale; 40–47 whole-group: the best ULN heard, re-delivered for the room; 47–50 exit ticket + M13 due tonight reminder.",Draft and twice-deliver your uncertainty-limitations-next-step paragraph; score partners on strength-not-apology.,📝 nb15 practice: convert 3 apology-spiral sentences into ULN form.,"Why does 'here is what this study cannot show' make an expert MORE believable, not less?",M14 (uncertainty & limitations statement) drafts its spoken core; written form completes Friday.,M13 (submitted tonight) → M14 — Uncertainty & Limitations Statement,12 min (ULN drafting) + 16 min (delivery rounds),ULN partner rounds with strength-not-apology scoring,M13 scripts due tonight 11:59 PM; findings at hand.,ULN paragraph + delivery scores,"Claim Ticket #33: my single most important limitation, stated in ULN form, ≤30 words.","Write the full M14 statement (uncertainty + limitations + hard-question bank starts Friday); due Fri Nov 13, 11:59 PM.",Three ULN demos prepped (incl. the null finding); scoring slips printed.,"ULNs collapse into apology → pause rounds, re-demo the spine posture, restart with the sentence stems on screen."
34,2026-11-13,Fri,in-person,Phase 6 — Conference preparation,Delivery III: hard questions — building and drilling your question bank,What is the hardest fair question a stranger could ask at your poster — and what will you say?,"What question types recur (method, alternative explanation, so-what, generalization, AI-use)? What does a good 'I don't know' contain? When do you defend vs concede?",all (communication),"""I don't know — but here is what I do know that bears on it, and here is how one would find out.""",Bluffing an answer you don't have (the one move that can destroy a presenter's credibility entirely).,(fresh unit),,nb15 §4 (Colab); hard-question taxonomy; M14 due tonight,brief §12 P6 + fresh question taxonomy | conference unit | Q&A drill protocol | fresh,question taxonomy; the honest-don't-know formula; defend vs concede judgment; question banks as preparation,none,each student's own project,"0–5 ULN redux (one volunteer, cold); 5–12 mini-lesson: the five question types with a real example of each + the honest-don't-know formula; 12–24 bank-building studio: write the 5 hardest fair questions for YOUR poster, one per type, with answer sketches (M14 bank); 24–44 HOT-SEAT ROUNDS: each student takes 3 minutes of rapid questions from the class (drawn from their bank + surprises), instructor models one save; 44–48 bank revision from what the hot seat exposed; 48–50 exit ticket + M14 due tonight.","Build your 5-question bank, then survive a 3-minute hot seat on it in front of the class.",📝 nb15 practice: classify 6 sample audience questions by type; draft the don't-know answer for the worst one.,Which classmate's hot-seat save impressed you most — what exactly did they do?,M14 completes tonight: statement + question bank = the intellectual armor for Nov 17.,M14 — Uncertainty & Limitations Statement + Question Bank (submitted TONIGHT),12 min (bank building) + 20 min (hot seats),hot-seat rounds (this is the presentation/review),M14 statement drafted; poster content cold.,5-question bank with answer sketches + hot-seat performance,"Claim Ticket #34: the question I most fear on Nov 17, and my first sentence in reply.",Submit M14 tonight 11:59 PM. Monday: full dress rehearsal — bring the poster (printed or full-screen) and both pitches.,Surprise-question deck per project; timer; model-save planned.,Hot seats run hot emotionally → instructor interposes as question-asker-of-record and slows cadence; the drill's purpose (safety through practice) is renamed aloud.
35,2026-11-16,Mon,in-person,Phase 6 — Conference preparation,Dress rehearsal: the full URC simulation — readiness audited,"Tomorrow is the real thing. Is every piece — poster, pitch, ULN, question bank, logistics — actually ready?","Does the full 3-minute walk land inside time? Do transitions between pitch and Q&A feel natural? Is the logistics checklist (location, time, dress, materials) complete?",all (communication),"""Readiness audit passed: rehearsed twice, question bank drilled, logistics confirmed — signed.""","""I'll wing it tomorrow."" (Rehearsal is the difference between nerves and panic.)",(none — rehearsal day),,nb15 §5 readiness audit (Colab); URC Expo logistics sheet,brief §12 P6 + fresh readiness audit | conference unit | full-dress simulation protocol | fresh,full-dress simulation; readiness auditing; pre-performance routine; logistics discipline,none,each student's own complete conference package,"0–4 rehearsal norms: run it like it's real, notes after not during; 4–44 FULL SIMULATION: two 20-minute stations rounds — in each round, 2–3 posters are 'live' with presenters standing them while the rest of class + instructor rotate as conference visitors (1-min pitches, 3-min walks, hard questions, ULN moments all get exercised); 44–48 readiness audit: sign the M15 checklist (rehearsed / drilled / logistics / materials); 48–50 final word + tomorrow's call time.",Stand your poster through a full simulated conference round; visit others as a critical-but-kind stranger.,📝 (embedded) the visitor role card: ask at least one question from each of the five types across your visits.,"(post-simulation, 2 min) One thing you saw a classmate do that you're stealing for tomorrow.",M15 readiness audit signed — the last gate before the real URC Expo tomorrow (Nov 17).,M15 — Dress Rehearsal + Readiness Audit (completed TODAY),40 min (simulation) + 4 min (audit),the full-dress simulation IS the presentation/review,Poster ready (printed or presentable); both pitches cold; question bank internalized.,Signed readiness audit + rehearsal performance,(on the audit sheet) The one thing I will do differently tomorrow because of today.,"URC EXPO TOMORROW (Tue Nov 17) — M16, required presentation. Wednesday: debrief; bring every question you were asked.",Room setup for stations; visitor role cards; confirm Expo logistics (time/place/setup) and communicate call time.,A poster's print failed → present full-screen today; emergency print run resolved before Tuesday (backup plan pre-arranged).
36,2026-11-18,Wed,in-person,"Phase 7 — Reflection, feedback, redesign",Conference debrief: what the audience taught you,What did strangers' questions reveal about your project that friends' questions never could?,Which questions recurred? Where did the pitch work and where did it wobble? What feedback is signal vs noise?,all (reflection),"""The audience data says: X landed, Y confused, Z was asked three times — here is what that evidences about my project.""","Treating applause as validation of the CLAIMS (a warm reception measures communication, not truth).",(none — debrief day),,nb16 §1–2 (Colab); M17 reflection template,brief §12 P7 + fresh debrief protocol | reflection unit | audience-data analysis | fresh,feedback as data; signal/noise triage; recurring-question analysis; the debrief discipline,none (a provided tally cell if wanted),each student's collected conference questions/reactions,"0–8 STORY ROUND: 90 seconds each — the single most surprising moment at your poster; 8–15 mini-lesson: feedback is data — code it like data (recurred? from whom? about claims or communication?); 15–32 coding studio: log every question you received into the nb16 tally (type, target, recurrence), find your pattern (M17 core); 32–44 pair analysis: swap tallies — what does your partner's pattern say that they can't see?; 44–48 reflection freewrite: the honest paragraph (what the conference changed in how I see my project); 48–50 exit ticket.",Code your conference questions like data and find the recurring pattern; read a partner's pattern back to them.,"📝 nb16 practice: classify 6 pieces of received feedback as claims-signal, communication-signal, or noise.",What question did you get that the class's hot seats never predicted — and why did we miss it?,The coded audience data feeds M17 (reflection) tonight and M18 (redesign plan) Friday.,M17 — Conference Reflection (submit tonight),17 min (coding studio) + 12 min (pair analysis) + 4 min (freewrite),story round + pair pattern-reading,"URC presented (M16 ✓); every question you were asked, captured.",Coded question tally + reflection paragraph (submitted as M17 tonight),"Claim Ticket #36: the most repeated audience question, and what its repetition evidences.",Submit M17 tonight 11:59 PM. Friday: feedback → redesign (bring your tally).,Own observation notes from the Expo per student; tally template checked.,"A student missed the Expo (illness/emergency) → the documented make-up presentation is scheduled (department session or recorded defense), debrief uses rehearsal data meanwhile."
